,Unnamed: 0.2,Unnamed: 0.1,Unnamed: 0,sentence,tag,label,tag_2
147,147,498,70,The 51-year-old Italian has been at loggerheads with the cash-strapped club's owners Suning over planned cost cutting which would prevent him building the team he wants to challenge at home and in Europe.,0 0 0 0 0 0 0 0 0 0 0 0 0 0 0 0 0 0 0 0 0 0 prevention prevention 0 0 0 0 effect 0 0 0 0 0 0 0 0 0 0 0 0,prevent,0 0 0 0 0 0 0 0 0 0 0 0 0 0 0 0 0 0 0 0 0 0 trigger1 trigger1 0 0 0 0 effect 0 0 0 0 0 0 0 0 0 0 0 0
148,148,275,206,"Although the government said the economy grew an estimated 2.5% in the third quarter, in line with expectations, analysts are increasingly predicting much more sluggish growth -- and therefore more corporate earnings disappointments -- for the fourth quarter.    ",0 0 0 0 0 0 cause 0 0 0 0 0 0 0 0 0 0 0 0 0 0 0 0 0 0 0 0 0 0 0 0 0 0 0 0 effect 0 0 0 0 0 0 0,cause,0 0 0 0 0 0 trigger1 0 0 0 0 0 0 0 0 0 0 0 0 0 0 0 0 0 0 0 0 0 0 0 0 0 0 0 0 effect 0 0 0 0 0 0 0
149,149,314,245,"In addition, GM's North American vehicle production fell 8.4% from a year ago, which hurt Delco Electronic's earnings, a company spokesman said. ",0 0 0 0 0 0 0 0 0 cause 0 0 0 0 0 0 0 0 effect 0 0 0 0 0 0 0 0 0 0,cause,0 0 0 0 0 0 0 0 0 trigger1 0 0 0 0 0 0 0 0 effect 0 0 0 0 0 0 0 0 0 0
150,150,454,25,"DR Congo President Felix Tshisekedi on May 6 proclaimed a 30-day ""state of siege"" -- effectively martial law -- in North Kivu and neighbouring Ituri province in a bid to curb bloodshed by the ADF.",0 0 0 0 0 0 0 0 prevention 0 0 0 0 0 0 0 0 0 0 0 0 0 0 0 0 0 0 0 0 0 0 0 0 0 0 effect 0 0 0 0,prevent,0 0 0 0 0 0 0 0 trigger1 0 0 0 0 0 0 0 0 0 0 0 0 0 0 0 0 0 0 0 0 0 0 0 0 0 0 effect 0 0 0 0
151,151,328,259,"""Cheerios and Honey Nut Cheerios have eaten away sales normally going to Kellogg's corn-based lines simply because they are made of oats,"" says Merrill Lynch food analyst William Maguire. ",0 0 0 0 0 0 0 effect 0 0 0 0 0 0 0 0 0 0 0 0 0 0 0 cause 0 0 0 0 0 0 0 0 0 0 0 0,cause,0 0 0 0 0 0 0 effect 0 0 0 0 0 0 0 0 0 0 0 0 0 0 0 trigger1 0 0 0 0 0 0 0 0 0 0 0 0
152,152,106,37,"The gross proceeds from the sale of the notes, which will be due on Nov. 1, 2004, will be used to reduce existing debt and for general corporate purposes, the company said. ",0 0 0 0 0 0 0 0 0 0 0 0 0 0 0 0 0 0 0 0 0 0 intention 0 effect 0 0 0 0 0 0 0 0 0 0 0 0,intend,0 0 0 0 0 0 0 0 0 0 0 0 0 0 0 0 0 0 0 0 0 0 trigger1 0 effect 0 0 0 0 0 0 0 0 0 0 0 0
153,153,399,330,"Yesterday alone, the city [ Memphis ] went around to turn on the heat for homes when people have not been able to pay [ their utility bills ]. """,0 0 0 0 0 0 0 0 0 0 0 effect 0 0 0 0 0 0 0 0 0 0 0 0 cause 0 0 0 0 0 0 0,cause,0 0 0 0 0 0 0 0 0 0 0 effect 0 0 0 0 0 0 0 0 0 0 0 0 trigger1 0 0 0 0 0 0 0
154,154,327,258,The company said it was delaying construction because of current market conditions.,0 0 0 0 0 effect 0 0 0 0 0 cause 0,cause,0 0 0 0 0 effect 0 0 0 0 0 trigger1 0
155,155,571,67,"After meeting with Prime Minister Benjamin Netanyahu, Blinken reiterated support for Israel's right to defend itself against rocket attacks by Gaza's Hamas rulers, adding that they must benefit from reconstruction aid.",0 0 0 0 0 0 0 0 0 0 condition 0 0 0 0 0 0 0 0 0 0 0 0 0 0 0 0 0 0 0 0 0 0 0 effect 0,enable,0 0 0 0 0 0 0 0 0 0 trigger1 0 0 0 0 0 0 0 0 0 0 0 0 0 0 0 0 0 0 0 0 0 0 0 effect 0
156,156,452,23,"Real, Barcelona and Juventus meanwhile retaliated through a Commercial Court in Madrid which referred the matter to the European Court of Justice, asking if UEFA was abusing its ""dominant position"" by seeking to block a competing tournament.",0 0 0 0 0 0 0 0 0 0 0 0 0 0 0 0 0 0 0 0 0 0 0 0 0 0 0 0 0 0 0 0 prevention 0 0 0 0 0 0 0 effect 0,prevent,0 0 0 0 0 0 0 0 0 0 0 0 0 0 0 0 0 0 0 0 0 0 0 0 0 0 0 0 0 0 0 0 trigger1 0 0 0 0 0 0 0 effect 0
157,157,378,309,"Many of our staff have tried to leave, but were unsuccessful because the walls from buildings and private residences are falling into the streets, so that it has pretty much blocked significantly most of the traffic. """,0 0 0 0 0 0 0 0 0 0 0 0 0 0 0 0 0 0 0 0 0 cause 0 0 0 0 0 0 0 0 0 0 effect 0 0 0 0 0 0 0,cause,0 0 0 0 0 0 0 0 0 0 0 0 0 0 0 0 0 0 0 0 0 trigger1 0 0 0 0 0 0 0 0 0 0 effect 0 0 0 0 0 0 0
158,158,386,317,The Texas legislature adopted the plan in 2003 after three contentious special sessions called by Republican Gov.,0 0 0 effect 0 0 0 0 0 0 0 0 0 cause 0 0 0,cause,0 0 0 effect 0 0 0 0 0 0 0 0 0 trigger1 0 0 0
159,159,311,242,"But the administration is n't putting any upper limit on how high the force could go after that, calculating that it would be a mistake to underestimate and an advantage to keep Saddam Hussein guessing. ",0 0 0 0 0 effect 0 0 0 0 0 0 0 0 0 0 0 0 0 cause 0 0 0 0 0 0 0 0 0 0 0 0 0 0 0 0 0,cause,0 0 0 0 0 effect 0 0 0 0 0 0 0 0 0 0 0 0 0 trigger1 0 0 0 0 0 0 0 0 0 0 0 0 0 0 0 0 0
160,160,584,80,"He urged the Malian and French authorities ""to do everything to secure his freedom"".",0 0 0 0 0 0 condition 0 0 0 0 0 0 0 effect 0 0,enable,0 0 0 0 0 0 trigger1 0 0 0 0 0 0 0 effect 0 0
161,161,141,72,Courtaulds has been under pressure to enhance shareholder value since takeover speculators -- including Australian financier Kerry Packer -- surfaced holding small stakes last year.,0 0 0 0 0 0 cause 0 0 0 0 0 0 0 0 0 0 0 0 effect 0 0 0 0 0 0,cause,0 0 0 0 0 0 trigger1 0 0 0 0 0 0 0 0 0 0 0 0 effect 0 0 0 0 0 0
162,162,143,74,"Though Mr. Packer has since sold his stake, Courtaulds is moving to keep its institutional shareholders happy. ",0 0 0 0 0 0 0 0 0 0 0 cause 0 effect 0 0 0 0 0,cause,0 0 0 0 0 0 0 0 0 0 0 trigger1 0 effect 0 0 0 0 0
163,163,70,1,"Subcontractors  will  be offered a settlement and a swift transition to new management  is expected  to avert an exodus of skilled workers from Waertsilae Marine's two big shipyards, government officials said.    ",0 0 0 0 0 0 0 0 0 prevention 0 0 0 0 0 0 0 0 effect 0 0 0 0 0 0 0 0 0 0 0 0 0 0 0 0,prevent,0 0 0 0 0 0 0 0 0 trigger1 0 0 0 0 0 0 0 0 effect 0 0 0 0 0 0 0 0 0 0 0 0 0 0 0 0
164,164,38,38,"Capital expenditure in 1990 will rise slightly, Mr. Marous said, from an estimated $470 million this year. ",0 0 0 0 0 0 0 0 0 0 0 0 0 0 0 0 0 0 0 0 0,0,0 0 0 0 0 0 0 0 0 0 0 0 0 0 0 0 0 0 0 0 0
165,165,88,19,He also rejected reports that his departure stemmed from disappointment the general manager's post had n't  also led to a board directorship at the London-based news organization.,0 0 0 0 0 0 0 0 0 0 0 0 0 0 O 0 0 0 0 0 0 0 effect 0 0 0 0 0 0 0 0,0,0 0 0 0 0 0 0 0 0 0 0 0 0 0 O 0 0 0 0 0 0 0 effect 0 0 0 0 0 0 0 0
166,166,221,152,"Junk-fund holders have barely broken even this year, as fat interest payments barely managed to offset declining prices. ",0 0 0 0 0 0 effect 0 0 0 0 0 0 0 0 0 cause 0 0 0 0 0,cause,0 0 0 0 0 0 effect 0 0 0 0 0 0 0 0 0 trigger1 0 0 0 0 0
167,167,333,264,London shares were depressed initially by overnight losses in New York and by the drop in sterling after Mr. Lawson's resignation.,0 0 0 effect 0 0 0 cause 0 0 0 0 0 0 0 0 0 0 0 0 0 0 0,cause,0 0 0 effect 0 0 0 trigger1 0 0 0 0 0 0 0 0 0 0 0 0 0 0 0
168,168,65,65,The semiconductor concern said the interruption in shipment of its 80486 computer chip will be brief and have little impact on the company's earnings.,0 0 0 0 0 0 0 0 0 0 0 0 0 0 0 0 0 0 0 0 0 0 0 0 0 0,0,0 0 0 0 0 0 0 0 0 0 0 0 0 0 0 0 0 0 0 0 0 0 0 0 0 0
169,169,155,86,"Ocean Drilling amp Exploration Co. will sell its contract-drilling business, and took a $50.9 million loss from discontinued operations in the third quarter because of the planned sale.    ",0 0 0 0 0 0 effect 0 0 0 0 0 0 0 0 0 0 0 0 0 0 0 0 0 0 0 0 0 0 0 0 cause 0 0,cause,0 0 0 0 0 0 effect 0 0 0 0 0 0 0 0 0 0 0 0 0 0 0 0 0 0 0 0 0 0 0 0 trigger1 0 0
170,170,607,103,"""It's far too much money for five birds but we are donating a large part to bird keepers in a centre near here to help animals in difficulty.",0 0 0 0 0 0 0 0 0 0 0 0 0 condition 0 0 0 0 0 0 0 0 0 0 0 0 0 effect 0 0 0,enable,0 0 0 0 0 0 0 0 0 0 0 0 0 trigger1 0 0 0 0 0 0 0 0 0 0 0 0 0 effect 0 0 0
171,171,402,333,"Florida Fish &amp; Wildlife officers have rescued 120 sea turtles after water temperatures in the 40s shocked their tropically inclined systems, according to CNN affiliate WPBF.""",0 0 0 0 0 0 0 0 cause 0 0 0 0 0 0 0 0 0 effect 0 0 0 0 0 0 0 0 0 0 0 0,cause,0 0 0 0 0 0 0 0 trigger1 0 0 0 0 0 0 0 0 0 effect 0 0 0 0 0 0 0 0 0 0 0 0
172,172,379,310,Read what people in Haiti are saying via social media Haiti's government is backed by a U.N. peacekeeping mission established after the ouster of former President Jean-Bertrand Aristide in 2004.,0 0 0 0 0 0 0 0 0 0 0 0 0 0 effect 0 0 0 0 0 cause 0 0 0 0 0 0 0 0 0 0 0 0 0,cause,0 0 0 0 0 0 0 0 0 0 0 0 0 0 effect 0 0 0 0 0 trigger1 0 0 0 0 0 0 0 0 0 0 0 0 0
173,173,520,16,"But this list was accompanied by new demands which France's fisheries ministry has said were not arranged or discussed with Paris, effectively creating new zoning rules for the waters near Jersey.",0 0 0 0 0 0 0 condition 0 0 0 0 0 0 0 0 0 0 0 0 0 0 0 0 0 0 0 effect 0 0 0 0 0 0,enable,0 0 0 0 0 0 0 trigger1 0 0 0 0 0 0 0 0 0 0 0 0 0 0 0 0 0 0 0 effect 0 0 0 0 0 0
174,174,186,117,"DPC, an investor group led by New York-based Crescott Investment Associates, had itself filed a suit in state court in Los Angeles seeking to nullify the agreement. ",0 0 0 0 0 0 0 0 0 0 0 0 0 0 0 0 0 cause 0 0 0 0 0 0 0 0 0 0 effect 0 0 0,cause,0 0 0 0 0 0 0 0 0 0 0 0 0 0 0 0 0 trigger1 0 0 0 0 0 0 0 0 0 0 effect 0 0 0
175,175,0,0,"According to department policy, prosecutors must make a strong showing that lawyers' fees came from assets tainted by illegal profits before any attempts at seizure are made.    ",0 0 0 0 0 0 0 0 0 0 0 0 0 0 0 0 0 0 0 0 0 0 0 0 0 0 0 0 0 0,0,0 0 0 0 0 0 0 0 0 0 0 0 0 0 0 0 0 0 0 0 0 0 0 0 0 0 0 0 0 0
176,176,606,102,"The pass, which can be downloaded on a person's mobile phone two weeks after receiving their second shot, gives the bearer permission to move about freely in cities under lockdown to go to the supermarket, pharmacy, or for open air exercise.",0 condition 0 0 0 0 0 0 0 0 0 0 0 0 0 0 0 0 0 0 0 0 0 0 effect 0 0 0 0 0 0 0 0 0 0 0 0 0 0 0 0 0 0 0 0 0 0,enable,0 trigger1 0 0 0 0 0 0 0 0 0 0 0 0 0 0 0 0 0 0 0 0 0 0 effect 0 0 0 0 0 0 0 0 0 0 0 0 0 0 0 0 0 0 0 0 0 0
177,177,255,186,The president also has offered  to help offsetJordan's costs because 40 percent of its exports go to Iraq and 90percent of its oil comes from there.,0 0 0 0 0 0 effect 0 0 0 0 0 0 0 0 0 cause 0 0 0 0 0 0 0 0 0 0 0,cause,0 0 0 0 0 0 effect 0 0 0 0 0 0 0 0 0 trigger1 0 0 0 0 0 0 0 0 0 0 0
178,178,59,59,"Eight trading days after Oct. 12, the day before the stock market plunge, for instance, the Nasdaq Composite had fallen 4.3%, compared with 3.3% for the SampP 500, 3.5% for the New York Stock Exchange Composite Index and 3.6% for the industrial average. ",0 0 0 0 0 0 0 0 0 0 0 0 0 0 0 0 0 0 0 0 0 0 0 0 0 0 0 0 0 0 0 0 0 0 0 0 0 0 0 0 0 0 0 0 0 0 0 0 0 0 0 0 0,0,0 0 0 0 0 0 0 0 0 0 0 0 0 0 0 0 0 0 0 0 0 0 0 0 0 0 0 0 0 0 0 0 0 0 0 0 0 0 0 0 0 0 0 0 0 0 0 0 0 0 0 0 0
179,179,148,79,"The spokesman said that the proposed guidelines caused Crossland to revise its business objectives and, consequently , to write down the asset value of some previous acquisitions. ",0 0 0 0 0 0 0 0 0 0 cause 0 0 0 0 0 0 0 0 effect 0 0 0 0 0 0 0 0 0,cause,0 0 0 0 0 0 0 0 0 0 trigger1 0 0 0 0 0 0 0 0 effect 0 0 0 0 0 0 0 0 0
180,180,58,58,"But, he observes, while makers suffer losses when program trading drags the market down, they also make money when program trading pushes the prices higher. ",0 0 0 0 0 0 0 0 0 0 0 0 0 0 0 0 0 0 0 0 0 0 0 0 0 0 0 0 0,0,0 0 0 0 0 0 0 0 0 0 0 0 0 0 0 0 0 0 0 0 0 0 0 0 0 0 0 0 0
181,181,594,90,"The company's confidence in its VzLinux distro has led to an in-house conversion of more than 200+ CentOS servers, ensuring Virtuozzo's infrastructure is future-proofed well beyond December 2021 when CentOS is slated for end-of-life.",0 0 0 0 0 0 condition 0 0 0 0 0 0 0 0 0 0 0 0 0 0 0 0 0 0 0 0 0 0 effect effect effect 0 0 0 0 0 0 0 0 0 0 0 0 0 0 0,enable,0 0 0 0 0 0 trigger1 0 0 0 0 0 0 0 0 0 0 0 0 0 0 0 0 0 0 0 0 0 0 effect effect effect 0 0 0 0 0 0 0 0 0 0 0 0 0 0 0
182,182,189,120,"The offer, which was due to expire yesterday, is conditional on 50.1% of Dunkin' common shares, on a fully diluted basis, being tendered and on the withdrawal of the company's poison pill rights plan.    ",0 0 0 0 0 0 0 effect 0 0 0 0 0 0 0 0 0 0 0 0 0 0 0 0 0 0 0 0 0 0 0 0 cause 0 0 0 0 0 0 0 0 0 0,cause,0 0 0 0 0 0 0 effect 0 0 0 0 0 0 0 0 0 0 0 0 0 0 0 0 0 0 0 0 0 0 0 0 trigger1 0 0 0 0 0 0 0 0 0 0
183,183,288,219,And the U.S. now will face sharper questionsin the Arab world since it did n't  back  the peace proposalsworked out in Moscow.,0 0 0 0 0 effect 0 0 0 0 0 0 0 0 0 cause 0 0 0 0 0 0 0,cause,0 0 0 0 0 effect 0 0 0 0 0 0 0 0 0 trigger1 0 0 0 0 0 0 0
184,184,457,28,Regular OralHealth CheckUps Partner with your dental professional regularly to prevent and detect signs of gum infection at its earliest stages,0 0 prevention 0 0 0 0 0 0 0 0 0 0 0 0 0 effect 0 0 0 0,prevent,0 0 trigger1 0 0 0 0 0 0 0 0 0 0 0 0 0 effect 0 0 0 0
185,185,419,350,"Known for its slogan "" do n't do evil, "" Google's new position drew praise from supporters of free speech, who in the past have been critical of the search engine for agreeing to government censorship as a condition for opening its doors in China.""",cause 0 0 0 0 0 0 0 0 0 0 0 0 0 0 effect 0 0 0 0 0 0 0 0 0 0 0 0 0 0 0 0 0 0 0 0 0 0 0 0 0 0 0 0 0 0 0 0 0 0,cause,trigger1 0 0 0 0 0 0 0 0 0 0 0 0 0 0 effect 0 0 0 0 0 0 0 0 0 0 0 0 0 0 0 0 0 0 0 0 0 0 0 0 0 0 0 0 0 0 0 0 0 0
186,186,222,153,"Many funds in recent weeks and months have been selling their highest-quality junk issues, such as RJR Nabisco, to raise cash to meet expected redemptions.    ",0 0 0 0 0 0 0 0 0 cause 0 0 0 0 0 0 0 0 0 0 0 0 0 0 0 0 effect 0 0 0 0,cause,0 0 0 0 0 0 0 0 0 trigger1 0 0 0 0 0 0 0 0 0 0 0 0 0 0 0 0 effect 0 0 0 0
187,187,392,323,Investigators have spoken with consumers and conducted preliminary field work.,0 0 cause 0 0 0 effect 0 0 0 0,cause,0 0 trigger1 0 0 0 effect 0 0 0 0
188,188,551,47,"Building on Abu Dhabi's smart infrastructure and digital transformation, AWS's investment will further enable innovators and companies with globally-relevant solutions to realize new opportunities in the UAE and beyond.""",0 0 0 0 0 0 0 0 0 0 0 0 0 condition 0 0 0 0 0 0 0 0 0 0 0 0 0 0 effect 0 0 0 0 0 0 0,enable,0 0 0 0 0 0 0 0 0 0 0 0 0 trigger1 0 0 0 0 0 0 0 0 0 0 0 0 0 0 effect 0 0 0 0 0 0 0
189,189,230,161,"Ralston Purina Co. reported a 47% decline in fourth-quarter earnings, reflecting restructuring costs as well as a more difficult pet food market.    ",0 0 0 0 0 0 0 effect 0 0 0 0 0 0 0 0 cause 0 0 0 0 0 0 0 0 0 0 0,cause,0 0 0 0 0 0 0 effect 0 0 0 0 0 0 0 0 trigger1 0 0 0 0 0 0 0 0 0 0 0
190,190,235,166,"Aetna Life amp Casualty Co.'s third-quarter net income fell 22% to $182.6 million, or $1.63 a share, reflecting the damages from Hurricane Hugo and lower results for some of the company's major divisions.    ",0 0 0 0 0 0 0 0 0 0 0 effect 0 0 0 0 0 0 0 0 0 0 0 0 0 0 0 0 0 0 0 0 0 cause 0 0 0 0 0 0 0 0 0 0,cause,0 0 0 0 0 0 0 0 0 0 0 effect 0 0 0 0 0 0 0 0 0 0 0 0 0 0 0 0 0 0 0 0 0 trigger1 0 0 0 0 0 0 0 0 0 0
191,191,57,57,"""It makes no sense for us to put money at risk when you know you're going to lose,"" says Mr. Antolini, of Donaldson Lufkin.    ",0 0 0 0 0 0 0 0 0 0 0 0 0 0 0 0 0 0 0 0 0 0 0 0 0 0 0 0 0 0 0,0,0 0 0 0 0 0 0 0 0 0 0 0 0 0 0 0 0 0 0 0 0 0 0 0 0 0 0 0 0 0 0
192,192,437,8,I urge members of the Security Council and other Member States to take any steps possible to prevent a famine from occurring he said,0 0 0 0 0 0 0 0 0 0 0 0 0 0 prevention 0 0 0 0 effect 0 0 0 0,prevent,0 0 0 0 0 0 0 0 0 0 0 0 0 0 trigger1 0 0 0 0 effect 0 0 0 0
193,193,596,92,Campenaerts' withdrawal leaves the South African team down to five riders with the race to finish in Milan on Sunday after the withdrawals of Italians Domenico Pozzovivo and Giacomo Nizzolo.,0 0 condition effect 0 0 0 0 0 0 0 0 0 0 0 0 0 0 0 0 0 0 0 0 0 0 0 0 0 0 0 0,enable,0 0 trigger1 effect 0 0 0 0 0 0 0 0 0 0 0 0 0 0 0 0 0 0 0 0 0 0 0 0 0 0 0 0
194,194,368,299,"While a prisoner, Maria witnessed a sickening trade in human life and recalls how young girls were drugged, forced into prostitution and then murdered.",0 0 0 0 0 cause 0 0 0 0 0 0 0 0 0 0 0 0 0 0 0 0 0 0 0 effect 0,cause,0 0 0 0 0 trigger1 0 0 0 0 0 0 0 0 0 0 0 0 0 0 0 0 0 0 0 effect 0
195,195,588,84,"   -- A new adjustable voltage mode enabling a range from 15V to one of three maximum voltages (28V, 36V, or 48V) depending on the available power allowing the device being powered to request specific voltages to a 100 mV resolution.",0 0 0 0 0 0 condition 0 0 0 0 0 0 0 0 effect 0 0 0 0 0 0 0 0 0 0 0 0 0 0 0 0 0 0 0 0 0 0 0 0 0 0 0 0 0 0,enable,0 0 0 0 0 0 trigger1 0 0 0 0 0 0 0 0 effect 0 0 0 0 0 0 0 0 0 0 0 0 0 0 0 0 0 0 0 0 0 0 0 0 0 0 0 0 0 0
196,196,223,154,"Many funds in recent weeks and months have been selling their highest-quality junk issues, such as RJR Nabisco, to raise cash to meet expected redemptions.    ",0 0 0 0 0 0 0 0 0 cause 0 0 0 0 0 0 0 0 0 0 0 0 0 effect 0 0 0 0 0 0 0,cause,0 0 0 0 0 0 0 0 0 trigger1 0 0 0 0 0 0 0 0 0 0 0 0 0 effect 0 0 0 0 0 0 0
197,197,599,95,"Lovell-Badge said while the ISSCR was not recommending a new time limit, it has called for public consultation and an ethical framework that could allow longer research on robust scientific grounds.",0 0 0 0 0 0 0 0 0 0 0 0 0 0 0 0 0 0 0 0 0 0 0 0 condition 0 0 0 0 0 0 0 effect 0 0,enable,0 0 0 0 0 0 0 0 0 0 0 0 0 0 0 0 0 0 0 0 0 0 0 0 trigger1 0 0 0 0 0 0 0 effect 0 0
198,198,200,131,Rights attached to the company's common shares were issued that are triggered if a hostile bidder acquires more than 20% of the shares outstanding.,0 0 0 0 0 0 0 0 0 cause 0 0 0 0 0 0 0 effect 0 0 0 0 0 0 0 0 0,cause,0 0 0 0 0 0 0 0 0 trigger1 0 0 0 0 0 0 0 effect 0 0 0 0 0 0 0 0 0
199,199,75,6,"In addition to the estimated 45,000 Marines to ultimately bepart of Operation Desert Shield, Stealth fighter planes and theaircraft carrier John F. Kennedy  are  also headed to Saudi Arabia  to protect it from Iraqi expansionism.   ",0 0 0 0 0 0 0 0 0 0 0 0 0 0 0 0 0 0 0 0 0 0 0 0 0 0 prevention 0 0 0 0 0 0 0 0 effect 0 0,prevent,0 0 0 0 0 0 0 0 0 0 0 0 0 0 0 0 0 0 0 0 0 0 0 0 0 0 trigger1 0 0 0 0 0 0 0 0 effect 0 0
200,200,94,25,"Mr. Edelman declined to specify what prompted the recent moves, saying they are meant only to benefit shareholders when ""the company is on a roll."" ",0 0 0 0 0 0 0 0 0 intention 0 0 0 0 0 0 0 effect 0 0 0 0 0 0 0 0 0 0 0,intend,0 0 0 0 0 0 0 0 0 trigger1 0 0 0 0 0 0 0 effect 0 0 0 0 0 0 0 0 0 0 0
201,201,509,5,"The Sandbox includes access to Temenos Banking Services, Temenos MarketPlace, example data, and integration tools to enable banks to configure new products.",0 condition 0 0 0 0 0 0 0 0 0 0 0 0 0 0 0 0 0 0 0 0 effect 0 0 0,enable,0 trigger1 0 0 0 0 0 0 0 0 0 0 0 0 0 0 0 0 0 0 0 0 effect 0 0 0
202,202,423,354,Conservationists have welcomed the decision to reject a bid from Tanzania and Zambia to temporarily suspend a worldwide ban on trading in African elephant ivory so they can offload legal stockpiles in a one-off sale.,0 0 0 0 0 0 0 0 0 0 0 0 0 0 0 cause 0 0 0 0 0 0 0 0 0 0 0 0 effect 0 0 0 0 0 0 0 0 0,cause,0 0 0 0 0 0 0 0 0 0 0 0 0 0 0 trigger1 0 0 0 0 0 0 0 0 0 0 0 0 effect 0 0 0 0 0 0 0 0 0
203,203,532,28,"Switzerland will re-open indoor restaurants and people will no longer be required to work from home, the government announced Wednesday, saying it was lifting Covid restrictions faster than previously planned.",0 0 effect effect effect 0 0 0 0 0 0 0 0 0 0 0 0 0 0 0 0 0 0 0 0 0 0 0 0 condition 0 0 0 0 0,enable,0 0 effect effect effect 0 0 0 0 0 0 0 0 0 0 0 0 0 0 0 0 0 0 0 0 0 0 0 0 trigger1 0 0 0 0 0
204,204,316,247,The restaurant operator cited transaction costs from its 1988 recapitalization as a result of a $160 million restructuring of its bank debt.,0 0 0 effect 0 0 0 0 0 0 0 0 0 0 0 0 0 0 cause 0 0 0 0 0,cause,0 0 0 effect 0 0 0 0 0 0 0 0 0 0 0 0 0 0 trigger1 0 0 0 0 0
205,205,168,99,"The company attributed the decrease in part to the exclusion of the company's British sales from the current year's figures as a result of the subsidiary's status as a proposed discontinued operation and, in part, to lower sales in certain key foreign and domestic accounts. ",0 0 0 0 effect 0 0 0 0 0 0 0 0 0 0 cause 0 0 0 0 0 0 0 0 0 0 0 0 0 0 0 0 0 0 0 0 0 0 0 0 0 0 cause 0 0 0 0 0 0 0 0,cause,0 0 0 0 effect 0 0 0 0 0 0 0 0 0 0 trigger1 0 0 0 0 0 0 0 0 0 0 0 0 0 0 0 0 0 0 0 0 0 0 0 0 0 0 trigger1 0 0 0 0 0 0 0 0
206,206,9,9,"Fluor Daniel already has reassigned most of its work crew, the sources said.    ",0 0 0 0 0 0 0 0 0 0 0 0 0 0 0 0,0,0 0 0 0 0 0 0 0 0 0 0 0 0 0 0 0
207,207,602,98,"After a female stork was electrocuted on a power line, the inhabitants of a village in the Czech Republic decided to rally to help her partner and their four hatchlings in order to save them.",0 0 0 0 0 condition 0 0 0 0 0 0 0 0 0 0 0 0 0 0 0 0 0 0 0 0 0 0 0 0 0 0 0 0 effect 0 0,enable,0 0 0 0 0 trigger1 0 0 0 0 0 0 0 0 0 0 0 0 0 0 0 0 0 0 0 0 0 0 0 0 0 0 0 0 effect 0 0
208,208,86,17,The New Orleans oil and gas exploration and diving operations company added that it does n't expect any further adverse financial impact from the restructuring.,0 0 0 0 0 0 0 0 0 0 0 0 0 0 0 0 0 0 0 0 0 effect 0 0 O 0,0,0 0 0 0 0 0 0 0 0 0 0 0 0 0 0 0 0 0 0 0 0 effect 0 0 O 0
209,209,82,13,"The White House yesterday disclosed that Kuwait's ousted government has formally asked the U.S. to enforce the total trade embargo the United Nations has imposed on Iraq, allowing the U.S. and other nations to immediately begin stopping ships carrying Iraqi goods.   ",0 0 0 0 0 0 0 0 0 0 0 0 0 0 0 0 prevention 0 0 0 0 0 0 0 0 0 0 0 0 0 0 0 0 0 0 0 0 0 0 0 effect 0 0 0 0,prevent,0 0 0 0 0 0 0 0 0 0 0 0 0 0 0 0 trigger1 0 0 0 0 0 0 0 0 0 0 0 0 0 0 0 0 0 0 0 0 0 0 0 effect 0 0 0 0
210,210,515,11,"For students and educators, AWS will provide higher education institutions and their educators with cloud computing courses to prepare students to pursue industry-recognized certifications and careers in cloud. computing.",0 0 0 0 0 0 0 0 0 0 0 0 0 0 0 0 0 condition 0 0 0 0 0 0 0 0 0 0 effect 0 0 0 0 0,enable,0 0 0 0 0 0 0 0 0 0 0 0 0 0 0 0 0 trigger1 0 0 0 0 0 0 0 0 0 0 effect 0 0 0 0 0
211,211,140,71,"Some analysts have said Courtaulds' moves could boost the company's value by 5% to 10%, because the two entities separately will carry a higher price earnings multiple than they did combined. ",0 0 0 0 0 0 0 0 effect 0 0 0 0 0 0 0 0 0 0 0 0 0 0 0 0 0 cause 0 0 0 0 0 0 0 0 0 0,cause,0 0 0 0 0 0 0 0 effect 0 0 0 0 0 0 0 0 0 0 0 0 0 0 0 0 0 trigger1 0 0 0 0 0 0 0 0 0 0
212,212,56,56,"In such an environment, market makers can suffer huge losses both on trades made that day at steadily dropping prices and in the value of their inventories of shares.    ",0 0 0 0 0 0 0 0 0 0 0 0 0 0 0 0 0 0 0 0 0 0 0 0 0 0 0 0 0 0 0 0,0,0 0 0 0 0 0 0 0 0 0 0 0 0 0 0 0 0 0 0 0 0 0 0 0 0 0 0 0 0 0 0 0
213,213,365,296,"I'm sure the problem that we saw in Pakistan is shared in Haiti -- in that concrete buildings have been built poorly, without adequate technical supervision, and have proved very vulnerable to the earthquake.",0 0 0 0 0 0 0 0 0 0 0 0 0 0 0 0 0 0 0 0 0 cause 0 0 0 0 0 0 0 0 0 effect 0 0 0 0 0 0,cause,0 0 0 0 0 0 0 0 0 0 0 0 0 0 0 0 0 0 0 0 0 trigger1 0 0 0 0 0 0 0 0 0 effect 0 0 0 0 0 0
214,214,572,68,The Oral-B iO's revolutionary technology removes 100% more plaque than a manual brush to give you that professional clean teeth every single day.,0 0 0 0 0 0 0 0 0 0 0 0 condition 0 0 0 0 0 0 0 0 0 0 effect 0 0 0 0,enable,0 0 0 0 0 0 0 0 0 0 0 0 trigger1 0 0 0 0 0 0 0 0 0 0 effect 0 0 0 0
215,215,352,283,Dow Jones said it extended the offer to allow shareholders time to review a supplement to the Dow Jones tender offer circular that it mailed last Friday.,0 0 0 0 condition 0 0 0 0 0 0 0 effect 0 0 0 0 0 0 0 0 0 0 0 0 0 0 0,enable,0 0 0 0 trigger1 0 0 0 0 0 0 0 effect 0 0 0 0 0 0 0 0 0 0 0 0 0 0 0
216,216,541,37,"The company provides software solutions and services to over 450 service providers, ISVs, and enterprises worldwide to enable over 500 thousand virtual environments, running mission-critical cloud workloads.",0 0 0 0 0 0 condition 0 0 0 0 0 0 0 0 0 0 0 0 0 0 0 0 0 0 0 0 0 0 0 0 effect 0,enable,0 0 0 0 0 0 trigger1 0 0 0 0 0 0 0 0 0 0 0 0 0 0 0 0 0 0 0 0 0 0 0 0 effect 0
217,217,111,42,The combined operations  are designed  to isolate and strangleIraq until it retreats from Kuwait.,0 0 intention 0 0 0 0 0 0 0 0 effect 0 0 0,intend,0 0 trigger1 0 0 0 0 0 0 0 0 effect 0 0 0
218,218,587,83,"""The Mohammed Bin Rashid Space Centre has always sought to provide innovative solutions that benefit the scientific community.",0 0 0 0 0 0 0 0 0 condition 0 0 0 0 0 0 0 0 effect 0,enable,0 0 0 0 0 0 0 0 0 trigger1 0 0 0 0 0 0 0 0 effect 0
219,219,608,104,"Italy's government said Wednesday it had passed an ""important step"" in negotiations with the European Commission to create a new, leaner airline from its beleaguered Alitalia carrier, Italian media reported.",0 0 0 0 0 0 0 0 0 0 0 condition 0 0 0 0 0 0 0 0 0 0 0 0 0 effect 0 0 0 0 0 0 0 0 0 0,enable,0 0 0 0 0 0 0 0 0 0 0 trigger1 0 0 0 0 0 0 0 0 0 0 0 0 0 effect 0 0 0 0 0 0 0 0 0 0
220,220,5,5,"""I really do n't see the government doing something that Jaguar does n't want over the next 14 months,"" said Kenneth Warren, a Conservative member of Parliament and chairman of the Select Committee on Trade and Industry in Britain's House of Commons. ",0 0 0 0 0 0 0 0 0 0 0 0 0 0 0 0 0 0 0 0 0 0 0 0 0 0 0 0 0 0 0 0 0 0 0 0 0 0 0 0 0 0 0 0 0 0 0 0,0,0 0 0 0 0 0 0 0 0 0 0 0 0 0 0 0 0 0 0 0 0 0 0 0 0 0 0 0 0 0 0 0 0 0 0 0 0 0 0 0 0 0 0 0 0 0 0 0
