,Unnamed: 0.2,Unnamed: 0.1,Unnamed: 0,sentence,tag,label,tag_2
296,296,400,331,"Alabama issued a warning to drivers Thursday night, urging them to stay off icy roads as driving conditions were "" becoming dangerous "" with numerous accidents reported.",0 0 0 0 0 0 0 0 0 effect 0 0 0 0 0 0 0 0 0 0 0 cause 0 0 0 0 0 0 0,cause,0 0 0 0 0 0 0 0 0 effect 0 0 0 0 0 0 0 0 0 0 0 trigger1 0 0 0 0 0 0 0
297,297,429,0,"The EU banned Belarusian planes from the bloc's airspace to avoid flying over the ex-Soviet country ruled by Alexander Lukashenko, often dubbed ""Europe's last dictator"".",0 0 prevention 0 0 0 0 0 0 0 0 0 effect 0 0 0 0 0 0 0 0 0 0 0 0 0 0 0 0 0 0 0 0,prevent,0 0 trigger1 0 0 0 0 0 0 0 0 0 effect 0 0 0 0 0 0 0 0 0 0 0 0 0 0 0 0 0 0 0 0
298,298,560,56,"US Secretary of State Antony Blinken said Wednesday that all aid would be ""administered in a way that benefits the Palestinian people -- not Hamas"", which Washington considers a terrorist group.",0 0 0 0 0 0 0 0 0 0 condition 0 0 0 0 0 0 0 0 0 0 effect 0 0 0 0 0 0 0 0 0 0 0 0 0,enable,0 0 0 0 0 0 0 0 0 0 trigger1 0 0 0 0 0 0 0 0 0 0 effect 0 0 0 0 0 0 0 0 0 0 0 0 0
299,299,538,34,"The EMA is continuing to evaluate the safety of all four vaccines it has approved for use in the EU, which also includes the ones from BioNTech/Pfizer and Moderna.",0 0 0 0 0 0 0 condition 0 0 0 0 0 0 0 0 effect 0 0 0 0 0 0 0 0 0 0 0 0 0 0 0 0,enable,0 0 0 0 0 0 0 trigger1 0 0 0 0 0 0 0 0 effect 0 0 0 0 0 0 0 0 0 0 0 0 0 0 0 0
300,300,374,305,"""The claims that Maria made were so serious that she was asked by the Department of Homeland Security to come to the U.S. to tell her story.",0 0 0 0 0 cause 0 0 0 0 0 0 effect 0 0 0 0 0 0 0 0 0 0 0 0 0 0 0 0,cause,0 0 0 0 0 trigger1 0 0 0 0 0 0 effect 0 0 0 0 0 0 0 0 0 0 0 0 0 0 0 0
301,301,517,13,"The funds from our recent capital increase and these new innovation loans secure our financial situation for the foreseeable future, allowing us to focus confidently on the implementation of our scientific and commercial roadmap.",0 condition 0 0 0 0 0 0 0 0 0 0 0 0 0 0 0 0 0 0 0 0 0 0 0 0 0 0 0 0 0 0 0 0 effect 0,enable,0 trigger1 0 0 0 0 0 0 0 0 0 0 0 0 0 0 0 0 0 0 0 0 0 0 0 0 0 0 0 0 0 0 0 0 effect 0
302,302,206,137,"They've been given a mandate from Switzerland"" to expand their U.S. chocolate operations. ",0 0 0 cause 0 0 0 0 0 0 effect 0 0 0 0 0,cause,0 0 0 trigger1 0 0 0 0 0 0 effect 0 0 0 0 0
303,303,201,132,"Once triggered, the rights allow holders to buy additional shares at 50% of the then current market price or, at the board's discretion, to receive securities or assets.    ",0 0 0 0 0 0 0 0 cause 0 0 0 0 0 0 0 0 0 0 0 0 0 0 0 0 0 0 0 0 effect 0 0 0 0 0,cause,0 0 0 0 0 0 0 0 trigger1 0 0 0 0 0 0 0 0 0 0 0 0 0 0 0 0 0 0 0 0 effect 0 0 0 0 0
304,304,146,77,"A spokesman said the savings bank may not qualify for the capital requirements because, under the proposed guidelines, its $380 million of preferred stock does n't meet the ""core capital"" criteria outlined under the new Financial Institutions Reform, Recovery and Enforcement Act of 1989. ",0 0 0 0 0 0 0 0 effect 0 0 0 0 0 0 0 0 0 0 0 0 0 0 0 0 0 0 0 0 cause 0 0 0 0 0 0 0 0 0 0 0 0 0 0 0 0 0 0 0 0 0,cause,0 0 0 0 0 0 0 0 effect 0 0 0 0 0 0 0 0 0 0 0 0 0 0 0 0 0 0 0 0 trigger1 0 0 0 0 0 0 0 0 0 0 0 0 0 0 0 0 0 0 0 0 0
305,305,151,82,"Ocean Drilling amp Exploration Co. will sell its contract-drilling business, and took a $50.9 million loss from discontinued operations in the third quarter because of the planned sale.    ",0 0 0 0 0 0 0 0 0 0 0 0 0 0 effect 0 0 0 0 0 0 0 0 0 0 0 0 0 0 0 cause 0 0 0,cause,0 0 0 0 0 0 0 0 0 0 0 0 0 0 effect 0 0 0 0 0 0 0 0 0 0 0 0 0 0 0 trigger1 0 0 0
306,306,604,100,"The new leadership team, employees, partners, customers and shareholders will all benefit under Herbert's leadership.",0 0 condition 0 0 0 0 0 0 0 0 0 0 0 effect 0 0 0 0 0,enable,0 0 trigger1 0 0 0 0 0 0 0 0 0 0 0 effect 0 0 0 0 0
307,307,574,70,"""I don't know what really happened in front of me, but I came into the corner and saw some guys on the ground and I couldn't pass on the right side because I was next to another guy, so I didn't have any chances to avoid a crash.",0 0 0 0 0 0 0 0 0 0 0 0 0 0 0 0 0 0 0 0 0 0 0 0 0 condition 0 0 0 0 0 0 0 0 0 0 0 0 0 0 0 0 0 0 0 0 0 0 0 0 0 0 0 effect 0,enable,0 0 0 0 0 0 0 0 0 0 0 0 0 0 0 0 0 0 0 0 0 0 0 0 0 trigger1 0 0 0 0 0 0 0 0 0 0 0 0 0 0 0 0 0 0 0 0 0 0 0 0 0 0 0 effect 0
308,308,313,244,"Profit at the unit fell to $110.6 million, or 37 cents a share, from $142.4 million, or 45 cents a share, largely because of a $24 million one-time charge associated with Hughes's previously announced plan to reduce employment by at least 6,000 people by year end. ",0 0 0 0 effect 0 0 0 0 0 0 0 0 0 0 0 0 0 0 0 0 0 0 0 0 0 0 0 0 0 0 0 0 0 0 0 0 0 0 0 0 0 0 0 cause 0 0 0 0 0 0 0 0 0 0 0 0,cause,0 0 0 0 effect 0 0 0 0 0 0 0 0 0 0 0 0 0 0 0 0 0 0 0 0 0 0 0 0 0 0 0 0 0 0 0 0 0 0 0 0 0 0 0 trigger1 0 0 0 0 0 0 0 0 0 0 0 0
309,309,508,4,"With The Temenos Banking Cloud, we empower banks to digitally transform and massively scale faster than ever.""",0 0 0 0 condition 0 0 0 0 0 0 0 0 0 effect 0 0 0 0 0,enable,0 0 0 0 trigger1 0 0 0 0 0 0 0 0 0 effect 0 0 0 0 0
310,310,332,263,London shares were depressed initially by overnight losses in New York and by the drop in sterling after Mr. Lawson's resignation.,0 0 0 effect 0 0 0 0 0 0 0 0 0 0 cause 0 0 0 0 0 0 0 0,cause,0 0 0 effect 0 0 0 0 0 0 0 0 0 0 trigger1 0 0 0 0 0 0 0 0
311,311,246,177,"But as the craze died, Coleco failed  to come up with another winner and filed for bankruptcy-law protection in July 1988.    ",0 0 0 0 cause 0 0 0 0 0 0 0 0 0 0 effect 0 0 0 0 0 0 0 0 0 0,cause,0 0 0 0 trigger1 0 0 0 0 0 0 0 0 0 0 effect 0 0 0 0 0 0 0 0 0 0
312,312,46,46,Estimates from traders put it at less than 5% of Nasdaq's average daily volume of roughly 133 million shares.,0 0 0 0 0 0 0 0 0 0 0 0 0 0 0 0 0 0 0 0 0 0,0,0 0 0 0 0 0 0 0 0 0 0 0 0 0 0 0 0 0 0 0 0 0
313,313,247,178,Mr. Lortie joined Provigo in 1985 and spearheaded the company's drive to grow outside its traditional food business.,0 0 cause 0 0 0 0 0 0 0 0 0 0 effect 0 0 0 0 0 0,cause,0 0 trigger1 0 0 0 0 0 0 0 0 0 0 effect 0 0 0 0 0 0
314,314,325,256,---   Unisys posted a $648.2 million loss for the third quarter as it moved quickly to take write-offs for various problems and prepare for a turnaround.,0 0 0 0 0 0 0 0 effect 0 0 0 0 0 0 0 0 0 0 0 0 0 0 0 0 0 cause 0 0 0 0,cause,0 0 0 0 0 0 0 0 effect 0 0 0 0 0 0 0 0 0 0 0 0 0 0 0 0 0 trigger1 0 0 0 0
315,315,580,76,"As part of the year-long partnership, Oral-B and Scientific American Custom Media are releasing a series of content, including educational resources from leading medical and dental researchers that will help readers better understand the connections between oral health and whole body health.",0 0 0 0 0 0 0 0 0 0 0 0 0 0 0 0 0 0 0 0 0 0 condition 0 0 0 0 0 0 0 0 0 0 0 0 0 0 0 0 0 0 0 effect effect 0 0 0 0 0,enable,0 0 0 0 0 0 0 0 0 0 0 0 0 0 0 0 0 0 0 0 0 0 trigger1 0 0 0 0 0 0 0 0 0 0 0 0 0 0 0 0 0 0 0 effect effect 0 0 0 0 0
316,316,95,26,"The message to the chief of staff was meant to be taken as a suggestionthat Sununu offer to resign, one highly placed source said. ",0 intention 0 0 0 0 0 0 0 0 0 effect 0 0 0 0 0 0 0 0 0 0 0 0 0 0,intend,0 trigger1 0 0 0 0 0 0 0 0 0 effect 0 0 0 0 0 0 0 0 0 0 0 0 0 0
317,317,105,36,Hudson's Bay Co. announced terms of a previously proposed rights issue that is expected to raise about 396 million Canadian dollars (US$337 million) net of expenses.,0 0 0 0 effect 0 0 0 0 0 0 0 0 0 0 0 intention 0 0 0 0 0 0 0 0 0 0 0 0 0 0,intend,0 0 0 0 effect 0 0 0 0 0 0 0 0 0 0 0 trigger1 0 0 0 0 0 0 0 0 0 0 0 0 0 0
318,318,555,51,"""Once again we have turned to our friends in Portugal to help both UEFA and the Champions League and I am, as always, very grateful to the FPF and the Portuguese government for agreeing to stage the match at such short notice,"" said UEFA president Aleksander Ceferin.",0 0 0 0 0 0 0 0 0 0 condition 0 0 0 0 0 0 0 0 0 0 0 0 0 0 0 0 0 0 0 0 0 0 0 0 0 0 0 effect 0 0 0 0 0 0 0 0 0 0 0 0 0 0,enable,0 0 0 0 0 0 0 0 0 0 trigger1 0 0 0 0 0 0 0 0 0 0 0 0 0 0 0 0 0 0 0 0 0 0 0 0 0 0 0 effect 0 0 0 0 0 0 0 0 0 0 0 0 0 0
319,319,529,25,Hyper-Personalized Recommendations will also help increase the matchmaking accuracy and enable companies to seize business opportunities effectively.,condition condition condition 0 0 0 0 0 0 effect 0 0 0 0 0 0 0 0 0 0,enable,trigger1 trigger1 trigger1 0 0 0 0 0 0 effect 0 0 0 0 0 0 0 0 0 0
320,320,389,320,The company said it was checking the brakes on the Lexus vehicle model HS250h -- as well as a Japanese model called the Sai -- because they use the same system as that used on the 2010 Toyota Prius.,0 0 0 0 0 effect 0 0 0 0 0 0 0 0 0 0 0 0 0 0 0 0 0 0 0 0 0 cause 0 0 0 0 0 0 0 0 0 0 0 0,cause,0 0 0 0 0 effect 0 0 0 0 0 0 0 0 0 0 0 0 0 0 0 0 0 0 0 0 0 trigger1 0 0 0 0 0 0 0 0 0 0 0 0
321,321,78,9,But even continued military success carries political anddiplomatic risks for President Bush and the U.S. The alliedrejection of the last-minute Soviet-led diplomatic effort to avoid the ground war enabled Mr. Bush to seize the initiativefrom an Iraq seemingly bent on dictating peace terms.,0 0 0 0 0 0 0 0 0 0 0 0 0 0 0 0 0 0 0 0 0 0 0 0 0 0 prevention 0 0 0 0 effect 0 0 0 0 0 0 0 0 0 0 0 0 0 0 0 0,prevent,0 0 0 0 0 0 0 0 0 0 0 0 0 0 0 0 0 0 0 0 0 0 0 0 0 0 trigger1 0 0 0 0 effect 0 0 0 0 0 0 0 0 0 0 0 0 0 0 0 0
322,322,89,20,The restructuring program  is designed  to increase the company's tangible capital ratio.,0 0 intention 0 0 0 effect 0 0 0 0 0 0 0,intend,0 0 trigger1 0 0 0 effect 0 0 0 0 0 0 0
323,323,394,325,"As many as 150 members of the U.N. mission in Haiti remained unaccounted for Wednesday afternoon following an earthquake that inflicted massive damage on the Caribbean nation's capital, U.N. officials said Wednesday.",0 0 0 0 0 0 0 0 0 0 0 effect 0 0 0 0 0 0 0 0 cause 0 0 0 0 0 0 0 0 0 0 0 0 0 0,cause,0 0 0 0 0 0 0 0 0 0 0 effect 0 0 0 0 0 0 0 0 trigger1 0 0 0 0 0 0 0 0 0 0 0 0 0 0
324,324,180,111,"In effect, McCaw has forced LIN's hand by bidding $1.9 billion for the stake earlier this month.    ",0 0 0 0 0 effect 0 0 0 0 cause 0 0 0 0 0 0 0 0 0 0 0,cause,0 0 0 0 0 effect 0 0 0 0 trigger1 0 0 0 0 0 0 0 0 0 0 0
325,325,372,303,He told me he wanted to see his mummy then I started crying and said'I do n't think you're ever going to see your mummy again.',0 cause 0 0 0 0 0 0 0 0 0 0 effect 0 0 0 0 0 0 0 0 0 0 0 0 0 0 0 0,cause,0 trigger1 0 0 0 0 0 0 0 0 0 0 effect 0 0 0 0 0 0 0 0 0 0 0 0 0 0 0 0
326,326,488,60,"In its first update since 2016, the International Society for Stem Cell Research (ISSCR) said the decades-old rule had little scientific merit, so they stopped short of giving the green light for researchers to breach the time constraint, which is baked into law in some countries.",0 0 0 0 0 0 0 0 0 0 0 0 0 0 0 0 0 0 0 0 0 0 0 0 0 prevention 0 0 0 0 0 0 0 0 0 0 0 0 effect 0 0 0 0 0 0 0 0 0 0 0 0 0 0 0,prevent,0 0 0 0 0 0 0 0 0 0 0 0 0 0 0 0 0 0 0 0 0 0 0 0 0 trigger1 0 0 0 0 0 0 0 0 0 0 0 0 effect 0 0 0 0 0 0 0 0 0 0 0 0 0 0 0
327,327,199,130,"Earnings  were hurt by disposal of operations in its restructuring, Reed said. ",0 0 effect 0 cause 0 0 0 0 0 0 0 0 0,cause,0 0 effect 0 trigger1 0 0 0 0 0 0 0 0 0
328,328,128,59,And the U.S. is taking similar steps to ensure that its naval force is adequate to carry out a blockade of Iraq and support a war if necessary.,0 0 0 0 intention 0 0 0 0 0 0 0 0 0 0 0 0 0 0 0 0 0 0 effect 0 0 0 0 0,intend,0 0 0 0 trigger1 0 0 0 0 0 0 0 0 0 0 0 0 0 0 0 0 0 0 effect 0 0 0 0 0
329,329,258,189,"In the year-ago period, Bethlehem earned $101.4 million, or $1.27 a share, including a $3.8 million gain from early retirement of debt.    ",0 0 0 0 0 0 0 0 0 0 0 0 0 0 0 0 0 0 0 0 0 0 0 0 effect 0 0 cause 0 0 0 0,cause,0 0 0 0 0 0 0 0 0 0 0 0 0 0 0 0 0 0 0 0 0 0 0 0 effect 0 0 trigger1 0 0 0 0
330,330,240,171,The charges were offset in part by a gain from the sale of the company's construction division.,0 0 0 effect 0 0 0 0 cause 0 0 0 0 0 0 0 0 0 0,cause,0 0 0 effect 0 0 0 0 trigger1 0 0 0 0 0 0 0 0 0 0
331,331,564,60,"""Amazon will help preserve MGM's heritage and catalog of films, and provide customers with greater access to these existing works.",0 condition 0 0 0 effect effect 0 0 0 0 0 0 0 0 0 0 0 0 0 0 0 0 0,enable,0 trigger1 0 0 0 effect effect 0 0 0 0 0 0 0 0 0 0 0 0 0 0 0 0 0
332,332,110,41,The combined operations  are designed  to isolate and strangleIraq until it retreats from Kuwait.,0 0 intention 0 0 0 effect 0 0 0 0 0 0 0 0,intend,0 0 trigger1 0 0 0 effect 0 0 0 0 0 0 0 0
333,333,296,227,"Du Pont, unlike companies hurt badly by sharp price declines for basic chemicals and plastics, is benefiting from its broad range of businesses. ",0 0 0 0 0 effect 0 0 0 0 cause 0 0 0 0 0 0 0 0 0 0 0 0 0 0 0,cause,0 0 0 0 0 effect 0 0 0 0 trigger1 0 0 0 0 0 0 0 0 0 0 0 0 0 0 0
334,334,248,179,"Last month, Canadian Bond Rating Service downgraded Provigo's commercial paper and debentures because of its lackluster performance.    ",0 0 0 0 0 0 0 effect 0 0 0 0 0 0 0 0 0 0 cause 0 0,cause,0 0 0 0 0 0 0 effect 0 0 0 0 0 0 0 0 0 0 trigger1 0 0
335,335,69,0,"Subcontractors  will  be offered a settlement and a swift transition to new management  is expected  to avert an exodus of skilled workers from Waertsilae Marine's two big shipyards, government officials said.    ",0 0 0 0 0 prevention 0 0 0 0 0 0 0 0 0 0 0 0 effect 0 0 0 0 0 0 0 0 0 0 0 0 0 0 0 0,prevent,0 0 0 0 0 trigger1 0 0 0 0 0 0 0 0 0 0 0 0 effect 0 0 0 0 0 0 0 0 0 0 0 0 0 0 0 0
336,336,300,231,"Profit climbed to $98 million from $71 million in the petroleum segment, as Du Pont's Conoco Inc. oil company was helped by crude oil prices higher than a year ago and by higher natural gas prices and volume.    ",0 effect 0 0 0 0 0 0 0 0 0 0 0 0 0 0 0 0 0 0 0 0 0 0 cause 0 0 0 0 0 0 0 0 0 0 0 0 0 0 0 0 0 0 0,cause,0 effect 0 0 0 0 0 0 0 0 0 0 0 0 0 0 0 0 0 0 0 0 0 0 trigger1 0 0 0 0 0 0 0 0 0 0 0 0 0 0 0 0 0 0 0
337,337,609,105,"With the new region, organizations of all sizes will be able to innovate faster and serve end-users with even lower latency across the region.""",0 0 0 0 0 0 0 0 0 0 0 0 0 condition 0 0 0 0 0 0 0 0 0 effect 0 0 0 0 0,enable,0 0 0 0 0 0 0 0 0 0 0 0 0 trigger1 0 0 0 0 0 0 0 0 0 effect 0 0 0 0 0
338,338,559,55,"""We are thrilled that the investment is approved and eager to leverage Kymeta's expertise in hybrid satellite and cellular connectivity solutions,"" said Youn Chul Kim, CEO of HSC.",0 0 0 0 0 0 condition 0 0 0 0 0 0 0 0 0 0 0 0 0 0 effect 0 0 0 0 0 0 0 0 0 0 0 0,enable,0 0 0 0 0 0 trigger1 0 0 0 0 0 0 0 0 0 0 0 0 0 0 effect 0 0 0 0 0 0 0 0 0 0 0 0
339,339,245,176,"But as the craze died, Coleco failed  to come up with another winner and filed for bankruptcy-law protection in July 1988.    ",0 0 0 0 cause 0 0 effect 0 0 0 0 0 0 0 0 0 0 0 0 0 0 0 0 0 0,cause,0 0 0 0 trigger1 0 0 effect 0 0 0 0 0 0 0 0 0 0 0 0 0 0 0 0 0 0
340,340,280,211,"He went on to addthat ""in so doing you not only return a nation to its people,but you will destroy the war machine of a ruthless dictator.""   ",0 0 0 0 0 0 0 0 cause 0 0 0 0 0 0 0 0 0 0 0 0 0 effect 0 0 0 0 0 0 0 0 0 0,cause,0 0 0 0 0 0 0 0 trigger1 0 0 0 0 0 0 0 0 0 0 0 0 0 effect 0 0 0 0 0 0 0 0 0 0
341,341,425,356,"A few people do think he is a real character, particularly with the tour of his house on'Baker Street' adding fuel to the fire so to speak, "" Mark Di-Toro from Visit Britain said.""",0 0 0 0 effect 0 0 0 0 0 0 0 0 0 0 0 0 0 0 0 0 cause 0 0 0 0 0 0 0 0 0 0 0 0 0 0 0 0 0 0 0,cause,0 0 0 0 effect 0 0 0 0 0 0 0 0 0 0 0 0 0 0 0 0 trigger1 0 0 0 0 0 0 0 0 0 0 0 0 0 0 0 0 0 0 0
342,342,404,335,"Moussavi has thereby accepted that he has issued statements even before this, based on which people took to the streets.",0 0 0 0 0 0 0 effect 0 0 0 0 0 0 0 0 0 cause 0 0 0 0,cause,0 0 0 0 0 0 0 effect 0 0 0 0 0 0 0 0 0 trigger1 0 0 0 0
343,343,17,17,"The Financial Times 100-share index shed 47.3 points to close at 2082.1, down 4.5% from the previous Friday and 6.8% from Oct. 13, when Wall Street's plunge helped spark the current weakness in London.    ",0 0 0 0 0 0 0 0 0 0 0 0 0 0 0 0 0 0 0 0 0 0 0 0 0 0 0 0 0 0 0 0 0 0 0 0 0 0 0 0 0 0 0,0,0 0 0 0 0 0 0 0 0 0 0 0 0 0 0 0 0 0 0 0 0 0 0 0 0 0 0 0 0 0 0 0 0 0 0 0 0 0 0 0 0 0 0
344,344,257,188,"Bethlehem Steel Corp., hammered by higher costs and lower shipments to key automotive and service-center customers, posted a 54% drop in third-quarter profit.    ",0 0 0 0 cause 0 0 0 0 0 0 0 0 0 0 0 0 0 0 0 0 0 0 0 effect 0 0 0 0 0 0 0,cause,0 0 0 0 trigger1 0 0 0 0 0 0 0 0 0 0 0 0 0 0 0 0 0 0 0 effect 0 0 0 0 0 0 0
345,345,173,104,"His appointment to that post, which has senior administrative, staff and policy responsibilities, followed a several-year tenure as Reuters's editor in chief. ",0 effect 0 0 0 0 0 0 0 0 0 0 0 0 0 0 0 0 0 0 0 cause 0 0 0 0 0 0 0,cause,0 effect 0 0 0 0 0 0 0 0 0 0 0 0 0 0 0 0 0 0 0 trigger1 0 0 0 0 0 0 0
346,346,25,25,They said contributing to the downward drift was the fact that many professional traders had chosen to square positions ahead of the weekend.,0 0 0 0 0 0 0 0 0 0 0 0 0 0 0 0 0 0 0 0 0 0 0 0,0,0 0 0 0 0 0 0 0 0 0 0 0 0 0 0 0 0 0 0 0 0 0 0 0
347,347,568,64,"""We are focusing on creating a large, sustainable ecosystem where our o9 global organization will serve as an enabler of a much larger pool of skills and capabilities across partners, both consulting and technology.",0 0 0 0 0 0 0 0 0 0 0 0 0 0 0 condition 0 0 0 0 0 0 0 0 0 0 0 0 0 0 0 effect 0 0 0 0 0 0,enable,0 0 0 0 0 0 0 0 0 0 0 0 0 0 0 trigger1 0 0 0 0 0 0 0 0 0 0 0 0 0 0 0 effect 0 0 0 0 0 0
348,348,174,105,"""If I  were choosing the people of tomorrow, I would  have chosen the people who are now on the board,"" he said.    ",0 0 0 0 0 0 0 0 0 0 0 0 0 effect 0 0 0 0 0 cause 0 0 0 0 0 0 0 0,cause,0 0 0 0 0 0 0 0 0 0 0 0 0 effect 0 0 0 0 0 trigger1 0 0 0 0 0 0 0 0
349,349,228,159,"That, he said, is why Unisys is overhauling its whole business: It needs to prepare for a world in which profit margins will be lower than computer companies have been used to.    ",0 0 0 0 0 0 0 0 0 effect 0 0 0 0 0 cause 0 0 0 0 0 0 0 0 0 0 0 0 0 0 0 0 0 0 0 0 0,cause,0 0 0 0 0 0 0 0 0 effect 0 0 0 0 0 trigger1 0 0 0 0 0 0 0 0 0 0 0 0 0 0 0 0 0 0 0 0 0
350,350,445,16,"Aftershocks from the Mount Nyiragongo volcano in eastern DR Congo rattled the nearby city of Goma on Wednesday, four days after its eruption, badly damaging several buildings and prevented hundreds of residents from  fleeing and the UN to relocate some of its staff.",prevention 0 0 0 0 0 0 0 0 0 0 0 0 0 0 0 0 0 0 0 0 0 0 0 0 0 0 0 0 0 0 0 0 effect 0 0 0 0 0 0 0 0 0 0 0 0 0,prevent,trigger1 0 0 0 0 0 0 0 0 0 0 0 0 0 0 0 0 0 0 0 0 0 0 0 0 0 0 0 0 0 0 0 0 effect 0 0 0 0 0 0 0 0 0 0 0 0 0
351,351,26,26,Traders said the market remains extremely nervous because of the wild swings seen on the New York Stock Exchange last week.,0 0 0 0 0 0 0 0 0 0 0 0 0 0 0 0 0 0 0 0 0 0,0,0 0 0 0 0 0 0 0 0 0 0 0 0 0 0 0 0 0 0 0 0 0
352,352,467,38,"""Belarusians now no longer have the possibility of fleeing Belarus if they want to escape the regime,"" she told AFP in an interview after EU leaders at a summit this week agreed to ban Belarusian carriers.",0 0 0 0 0 0 0 0 0 0 0 0 0 0 0 effect 0 0 0 0 0 0 0 0 0 0 0 0 0 0 0 prevention 0 0 0 0 0 0 0 0,prevent,0 0 0 0 0 0 0 0 0 0 0 0 0 0 0 effect 0 0 0 0 0 0 0 0 0 0 0 0 0 0 0 trigger1 0 0 0 0 0 0 0 0
353,353,249,180,"After the split, the company will have more than 4.7 million shares outstanding. ",0 0 cause 0 0 0 0 effect 0 0 0 0 0 0 0,cause,0 0 trigger1 0 0 0 0 effect 0 0 0 0 0 0 0
354,354,383,314,"The reality is that there is more demand than supply, and the increase in demand and decrease in supply is growing, so it makes a big difference how we're going to decide who's going to allocate water. """,0 0 0 0 0 0 0 0 0 0 0 0 0 0 0 0 0 0 0 0 0 cause 0 0 0 0 0 0 0 0 0 0 0 0 effect 0 0 0 0 0 0 0 0,cause,0 0 0 0 0 0 0 0 0 0 0 0 0 0 0 0 0 0 0 0 0 trigger1 0 0 0 0 0 0 0 0 0 0 0 0 effect 0 0 0 0 0 0 0 0
355,355,96,27,"The company said it expects to use the proceeds to repay certain bank debt and for general corporate purposes, including establishing new operating centers and possible acquisitions. ",0 0 0 0 0 0 effect 0 0 0 0 0 0 0 0 0 0 0 0 0 0 0 0 0 0 0 0 intention 0,intend,0 0 0 0 0 0 effect 0 0 0 0 0 0 0 0 0 0 0 0 0 0 0 0 0 0 0 0 trigger1 0
356,356,213,144,"The supplement contains various information that has been filed with the Securities and Exchange Commission since Dow Jones launched the offer on Sept. 26, but it does n't change the terms and conditions of the offer except to extend its expiration date.    ",0 0 0 0 0 0 0 0 effect 0 0 0 0 0 0 0 0 0 cause 0 0 0 0 0 0 0 0 0 0 0 0 0 0 0 0 0 0 0 0 0 0 0 0 0 0,cause,0 0 0 0 0 0 0 0 effect 0 0 0 0 0 0 0 0 0 trigger1 0 0 0 0 0 0 0 0 0 0 0 0 0 0 0 0 0 0 0 0 0 0 0 0 0 0
357,357,227,158,"That would be a huge problem if it were to continue, because Unisys is betting its business on the assumption that customers want to move away from using operating systems that run on only one manufacturer's equipment and toward systems -- mainly Unix -- that work on almost anyone's machines.    ",0 0 0 0 0 effect 0 0 0 0 0 0 0 0 0 cause 0 0 0 0 0 0 0 0 0 0 0 0 0 0 0 0 0 0 0 0 0 0 0 0 0 0 0 0 0 0 0 0 0 0 0 0 0 0 0,cause,0 0 0 0 0 effect 0 0 0 0 0 0 0 0 0 trigger1 0 0 0 0 0 0 0 0 0 0 0 0 0 0 0 0 0 0 0 0 0 0 0 0 0 0 0 0 0 0 0 0 0 0 0 0 0 0 0
358,358,210,141,"Of the total purchase price, $50 million cash and $30 million in stock (nearly 1.8 million shares) would be paid to buy the existing 700-room Marina Hotel amp Casino from Southwest Securities, a Nevada limited partnership. ",0 0 0 0 0 0 0 0 0 0 0 0 0 0 0 0 0 0 0 0 0 0 0 0 cause 0 effect 0 0 0 0 0 0 0 0 0 0 0 0 0 0 0 0 0 0,cause,0 0 0 0 0 0 0 0 0 0 0 0 0 0 0 0 0 0 0 0 0 0 0 0 trigger1 0 effect 0 0 0 0 0 0 0 0 0 0 0 0 0 0 0 0 0 0
359,359,24,24,"But they failed to sell these stocks to client investors, who were cautious about the sharp gains these issues made this week, the Wako official said.    ",0 0 0 0 0 0 0 0 0 0 0 0 0 0 0 0 0 0 0 0 0 0 0 0 0 0 0 0 0 0,0,0 0 0 0 0 0 0 0 0 0 0 0 0 0 0 0 0 0 0 0 0 0 0 0 0 0 0 0 0 0
360,360,35,35,"He said the independent power segment could grow to provide as much as 50% of near-term generation capacity, adding: ""We expect to supply a significant share of this market.""    ",0 0 0 0 0 0 0 0 0 0 0 0 0 0 0 0 0 0 0 0 0 0 0 0 0 0 0 0 0 0 0 0 0 0 0 0 0 0,0,0 0 0 0 0 0 0 0 0 0 0 0 0 0 0 0 0 0 0 0 0 0 0 0 0 0 0 0 0 0 0 0 0 0 0 0 0 0
361,361,430,1,EU leaders at their summit this week agreed in principle to banning Belarusian airlines from the bloc and urged EU-based carriers not to fly through Belarusian airspace.,0 0 0 0 0 0 0 prevention 0 0 0 0 0 0 0 0 0 0 0 0 0 0 0 0 0 effect 0 0 0 0,prevent,0 0 0 0 0 0 0 trigger1 0 0 0 0 0 0 0 0 0 0 0 0 0 0 0 0 0 effect 0 0 0 0
362,362,460,31,"""I urge members of the Security Council and other Member States to take any steps possible to prevent a famine from occurring,"" he said.",0 0 0 0 0 0 0 0 0 0 0 0 0 0 0 prevention 0 0 0 0 effect 0 0 0 0 0 0 0,prevent,0 0 0 0 0 0 0 0 0 0 0 0 0 0 0 trigger1 0 0 0 0 effect 0 0 0 0 0 0 0
363,363,197,128,"At a news conference, Mr. Fournier accused Paribas of planning to pay for the takeover by selling parts of the company, whose interests include insurance, banking, tuna canning, sugar and orange juice.    ",0 0 0 0 0 0 0 effect 0 0 cause 0 0 0 0 0 0 0 0 0 0 0 0 0 0 0 0 0 0 0 0 0 0 0 0 0 0 0 0,cause,0 0 0 0 0 0 0 effect 0 0 trigger1 0 0 0 0 0 0 0 0 0 0 0 0 0 0 0 0 0 0 0 0 0 0 0 0 0 0 0 0
364,364,586,82,"With its restructuring plan approved by Norwegian and Irish courts, the company can now emerge from bankruptcy protection.",0 0 0 condition 0 0 0 0 0 0 0 0 0 0 0 0 0 effect 0 0,enable,0 0 0 trigger1 0 0 0 0 0 0 0 0 0 0 0 0 0 effect 0 0
365,365,361,292,Several Google users and fans gathered in front of the company's China headquarters in northwest Beijing to express support for Internet freedom.,0 0 0 0 0 intention 0 0 0 0 0 0 0 0 0 0 0 0 effect 0 0 0 0 0,intend,0 0 0 0 0 trigger1 0 0 0 0 0 0 0 0 0 0 0 0 effect 0 0 0 0 0
366,366,50,50,"But the big, often tumultuous slide in stock prices this month has turned some of those who have been profiting from the practice against it.    ",0 0 0 0 0 0 0 0 0 0 0 0 0 0 0 0 0 0 0 0 0 0 0 0 0 0 0 0,0,0 0 0 0 0 0 0 0 0 0 0 0 0 0 0 0 0 0 0 0 0 0 0 0 0 0 0 0
367,367,595,91,"Oral-B was founded in 1950 by Dr. Robert Hutson, a California periodontist, who invented an innovative toothbrush to help his patients achieve healthier teeth and gums at home.",0 0 0 0 0 0 0 0 0 0 0 0 0 0 0 0 0 0 0 0 0 condition 0 0 0 0 0 0 effect 0 0 0 0 0,enable,0 0 0 0 0 0 0 0 0 0 0 0 0 0 0 0 0 0 0 0 0 trigger1 0 0 0 0 0 0 effect 0 0 0 0 0
368,368,244,175,"Net income includes an extraordinary gain of about $100,000 from the reversal of bad debt and interest income. ",0 0 0 0 0 effect 0 0 0 0 0 0 cause 0 0 0 0 0 0 0,cause,0 0 0 0 0 effect 0 0 0 0 0 0 trigger1 0 0 0 0 0 0 0
369,369,188,119,"National Intergroup in the year-ago third quarter earned $22.5 million, or 97 cents a share, including a gain of $18 million from the sale of a steel tube company. ",0 0 0 0 0 0 0 0 0 effect 0 0 0 0 0 0 0 0 0 0 0 0 0 0 0 0 0 0 0 cause 0 0 0 0 0 0,cause,0 0 0 0 0 0 0 0 0 effect 0 0 0 0 0 0 0 0 0 0 0 0 0 0 0 0 0 0 0 trigger1 0 0 0 0 0 0
370,370,297,228,"Du Pont, unlike companies hurt badly by sharp price declines for basic chemicals and plastics, is benefiting from its broad range of businesses. ",0 0 0 0 0 0 0 0 0 0 0 0 0 0 0 0 0 0 effect 0 0 0 0 0 cause 0,cause,0 0 0 0 0 0 0 0 0 0 0 0 0 0 0 0 0 0 effect 0 0 0 0 0 trigger1 0
371,371,103,34,"Philip Morris Cos., New York, adopted a defense measure designed to make a hostile takeover prohibitively expensive.    ",0 0 0 0 0 0 0 0 intention 0 0 0 0 0 effect 0 0 0 0 0 0 0,intend,0 0 0 0 0 0 0 0 trigger1 0 0 0 0 0 effect 0 0 0 0 0 0 0
