,Unnamed: 0.2,Unnamed: 0.1,Unnamed: 0,sentence,tag,label,tag_2
221,221,142,73,"Though Mr. Packer has since sold his stake, Courtaulds is moving to keep its institutional shareholders happy. ",0 0 0 0 0 cause 0 0 0 0 0 effect 0 0 0 0 0 0 0,cause,0 0 0 0 0 trigger1 0 0 0 0 0 effect 0 0 0 0 0 0 0
222,222,3,3,"""Without some unexpected ""coup de theatre"", I do n't see what will block the Paribas bid,"" said Philippe de Cholet, analyst at the brokerage Cholet-Dupont amp Cie. Mr. de Cholet said Mr. Fournier's biggest hope was to somehow persuade regulatory authorities to block the bid. ",0 0 0 0 0 0 0 0 0 0 0 0 0 0 0 0 0 0 0 0 0 0 0 0 0 0 0 0 0 0 0 0 0 0 0 0 0 0 0 0 0 0 0 0 0 0 0 0 0 0 0 0 0 0 0 0 0,0,0 0 0 0 0 0 0 0 0 0 0 0 0 0 0 0 0 0 0 0 0 0 0 0 0 0 0 0 0 0 0 0 0 0 0 0 0 0 0 0 0 0 0 0 0 0 0 0 0 0 0 0 0 0 0 0 0
223,223,49,49,"Moreover, the price volatility that is amplified by program trading is undercutting efforts to woo individual investors back to an OTC market that sorely misses them.    ",0 0 0 0 0 0 0 0 0 0 0 0 0 0 0 0 0 0 0 0 0 0 0 0 0 0 0 0 0,0,0 0 0 0 0 0 0 0 0 0 0 0 0 0 0 0 0 0 0 0 0 0 0 0 0 0 0 0 0
224,224,160,91,"But some analysts questioned how much of an impact the retirement package will have, because few jobs will end up being eliminated. ",0 0 0 effect 0 0 0 0 0 0 0 0 0 0 0 0 0 0 0 0 0 0 cause 0,cause,0 0 0 effect 0 0 0 0 0 0 0 0 0 0 0 0 0 0 0 0 0 0 trigger1 0
225,225,573,69,"Those without permits, by comparison, have to print out a permission form every time they want to leave the house, which will allow them to go out for essential reasons only.",0 0 0 0 0 0 0 0 0 0 effect 0 condition 0 0 0 0 0 0 0 0 0 0 0 0 0 0 0 0 0 0 0 0 0 0,enable,0 0 0 0 0 0 0 0 0 0 effect 0 trigger1 0 0 0 0 0 0 0 0 0 0 0 0 0 0 0 0 0 0 0 0 0 0
226,226,592,88,"We recently moved our headquarters and research and development center to Abu Dhabi to benefit from its rapidly growing innovation hub, and with the new AWS Region, we are excited to see it thrive at an accelerated rate.""",0 0 0 0 0 0 0 0 0 condition 0 0 0 0 0 0 0 0 0 effect 0 0 0 0 0 0 0 0 0 0 0 0 0 0 0 0 0 0 0 0 0 0,enable,0 0 0 0 0 0 0 0 0 trigger1 0 0 0 0 0 0 0 0 0 effect 0 0 0 0 0 0 0 0 0 0 0 0 0 0 0 0 0 0 0 0 0 0
227,227,18,18,"Dealers said the turnover, largely confined to the 100-share index stocks, partly reflected the flurry of activity typical at the close of a two-week trading account and the start of a new account. ",0 0 0 0 0 0 0 0 0 0 0 0 0 0 0 0 0 0 0 0 0 0 0 0 0 0 0 0 0 0 0 0 0 0 0 0 0 0 0 0,0,0 0 0 0 0 0 0 0 0 0 0 0 0 0 0 0 0 0 0 0 0 0 0 0 0 0 0 0 0 0 0 0 0 0 0 0 0 0 0 0
228,228,10,10,Last Friday's announcement was the first official word that the project was in trouble and that the company's plans for a surge in market share may have been overly optimistic.,0 0 0 0 0 0 0 0 0 0 0 0 0 0 0 0 0 0 0 0 0 0 0 0 0 0 0 0 0 0 0 0 0,0,0 0 0 0 0 0 0 0 0 0 0 0 0 0 0 0 0 0 0 0 0 0 0 0 0 0 0 0 0 0 0 0 0
229,229,177,108,"While competitors moved production offshore in response to the sagging competitiveness of Japanese factories, Sansui lacked the money to build new plants in Southeast Asia. ",0 0 effect 0 0 0 0 0 0 0 cause 0 0 0 0 0 0 0 0 0 0 0 0 0 0 0 0,cause,0 0 effect 0 0 0 0 0 0 0 trigger1 0 0 0 0 0 0 0 0 0 0 0 0 0 0 0 0
230,230,285,216,"After cabling world leadersabout his intention to give Saddam Hussein a final deadlineto exit Kuwait, he offered him a week to withdraw fully  , instead of the four days he originally considered, because ofobjections from some European partners that four days seemedpunitive and unrealistic.   ",0 0 0 0 0 0 0 0 0 0 0 0 0 0 0 0 0 effect 0 0 0 0 0 0 0 0 0 0 0 0 0 0 0 0 0 0 0 0 0 0 0 0 0 0 0 0 0 0,cause,0 0 0 0 0 0 0 0 0 0 0 0 0 0 0 0 0 effect 0 0 0 0 0 0 0 0 0 0 0 0 0 0 0 0 0 0 0 0 0 0 0 0 0 0 0 0 0 0
231,231,398,329,The arctic blast that began last weekend has been blamed for at least seven deaths across the nation.,0 0 0 0 cause 0 0 0 0 effect 0 0 0 0 0 0 0 0 0,cause,0 0 0 0 trigger1 0 0 0 0 effect 0 0 0 0 0 0 0 0 0
232,232,92,23,"Upjohn Co. said it will offer an early retirement package to as many as 1,100 employees in a cost-cutting move expected to result in a fourth-quarter charge.    ",0 0 0 0 0 intention 0 0 0 0 0 0 0 0 0 0 0 0 0 0 0 0 0 0 0 0 0 0 0 0 effect 0 0,intend,0 0 0 0 0 trigger1 0 0 0 0 0 0 0 0 0 0 0 0 0 0 0 0 0 0 0 0 0 0 0 0 effect 0 0
233,233,514,10,"The US State Department said it had been advised, including by public health professionals in Britain, that its health protocols ""would permit us to continue with our G7 activities as planned"".",0 0 0 0 0 0 0 0 0 0 0 0 0 0 0 0 0 0 0 0 0 condition 0 0 0 0 0 0 0 0 0 effect 0 0 0 0,enable,0 0 0 0 0 0 0 0 0 0 0 0 0 0 0 0 0 0 0 0 0 trigger1 0 0 0 0 0 0 0 0 0 effect 0 0 0 0
234,234,218,149,"In the past two months the nation's 88 junk funds have lost a total of about $6 billion -- more than 15% of assets -- through sales or transfers of junk-fund shares, Dalbar says. ",0 0 0 0 0 0 0 0 0 0 0 0 effect 0 0 0 0 0 0 0 0 0 0 0 0 0 0 0 0 0 0 cause 0 0 0 0 0 0 0 0 0,cause,0 0 0 0 0 0 0 0 0 0 0 0 effect 0 0 0 0 0 0 0 0 0 0 0 0 0 0 0 0 0 0 trigger1 0 0 0 0 0 0 0 0 0
235,235,209,140,"MGM Grand Inc. has agreed to pay $93 million and nearly 1.8 million common shares to buy 117 acres of land along the Las Vegas, Nev., Strip as a site for its planned movie-studio and theme-park resort.    ",0 0 0 0 0 0 cause 0 0 0 0 0 0 0 0 0 0 effect 0 0 0 0 0 0 0 0 0 0 0 0 0 0 0 0 0 0 0 0 0 0 0 0 0 0 0 0,cause,0 0 0 0 0 0 trigger1 0 0 0 0 0 0 0 0 0 0 effect 0 0 0 0 0 0 0 0 0 0 0 0 0 0 0 0 0 0 0 0 0 0 0 0 0 0 0 0
236,236,277,208,The bank also said its effort would continue past the Nov. 1 deadline set in that agreement and that the litigation between the two sides might resume as a result.,0 0 0 0 0 0 0 cause 0 0 0 0 0 0 0 0 0 0 0 0 0 0 0 0 0 0 effect 0 0 0 0,cause,0 0 0 0 0 0 0 trigger1 0 0 0 0 0 0 0 0 0 0 0 0 0 0 0 0 0 0 effect 0 0 0 0
237,237,104,35,"Mr. Stronach, founder and controlling shareholder of Magna, resigned as chief executive officer last year to seek , unsuccessfully, a seat in Canada's Parliament.    ",0 0 0 0 0 0 0 0 0 0 intention 0 0 0 0 0 0 0 effect 0 0 0 0 0 0 0 0 0 0 0,intend,0 0 0 0 0 0 0 0 0 0 trigger1 0 0 0 0 0 0 0 effect 0 0 0 0 0 0 0 0 0 0 0
238,238,256,187,The president also has offered  to help offsetJordan's costs because 40 percent of its exports go to Iraq and 90percent of its oil comes from there.,0 0 0 0 0 0 effect 0 0 0 0 0 0 0 0 0 0 0 0 0 0 0 0 0 cause 0 0 0,cause,0 0 0 0 0 0 effect 0 0 0 0 0 0 0 0 0 0 0 0 0 0 0 0 0 trigger1 0 0 0
239,239,449,20,Thousands of Australian Rules football fans were told to self-isolate and get tested for coronavirus Wednesday after an infected spectator attended a match in Melbourne and the city raced to avoid another lockdown.,0 0 0 0 0 0 0 0 0 prevention prevention prevention 0 0 0 0 0 0 0 0 0 0 0 0 0 0 0 0 0 0 0 0 0 0 effect 0,prevent,0 0 0 0 0 0 0 0 0 trigger1 trigger1 trigger1 0 0 0 0 0 0 0 0 0 0 0 0 0 0 0 0 0 0 0 0 0 0 effect 0
240,240,401,332,"But, he said football was helping keep people at home as University of Alabama fans cheered on their team in the National Championship Game against the University of Texas.",0 0 0 0 0 0 0 effect 0 0 0 0 0 0 0 0 cause 0 0 0 0 0 0 0 0 0 0 0 0 0 0,cause,0 0 0 0 0 0 0 effect 0 0 0 0 0 0 0 0 trigger1 0 0 0 0 0 0 0 0 0 0 0 0 0 0
241,241,74,5,The university had sought an injunction blocking Connaught's board from recommending or supporting an offer for the company by Merieux.,0 0 0 prevention 0 0 0 0 0 0 0 effect 0 0 0 0 0 0 0 0 0 0,prevent,0 0 0 trigger1 0 0 0 0 0 0 0 effect 0 0 0 0 0 0 0 0 0 0
242,242,238,169,N.V. DSM said net income in the third quarter jumped 63% as the company had substantially lower extraordinary charges to account for a restructuring program.,0 0 0 0 0 0 0 0 0 effect 0 0 0 0 0 0 0 0 0 cause 0 0 0 0 0 0 0,cause,0 0 0 0 0 0 0 0 0 effect 0 0 0 0 0 0 0 0 0 trigger1 0 0 0 0 0 0 0
243,243,348,279,"In addition, Courtaulds said the moves are logical because they will allow both the chemicals and textile businesses to focus more closely on core activities.    ",0 0 0 0 0 0 condition 0 0 0 0 0 0 0 0 0 0 0 0 0 effect 0 0 0 0 0 0 0,enable,0 0 0 0 0 0 trigger1 0 0 0 0 0 0 0 0 0 0 0 0 0 effect 0 0 0 0 0 0 0
244,244,330,261,"""As we regain our leadership level where we have been, and as we continue to put new products into the marketplace and need additional capacity, we will look at resuming our involvement with our plan,"" he said.    ",0 0 0 cause 0 0 0 0 0 0 0 0 0 0 0 0 0 0 0 0 0 0 0 0 0 0 0 0 0 0 effect 0 0 0 0 0 0 0 0 0 0 0 0 0,cause,0 0 0 trigger1 0 0 0 0 0 0 0 0 0 0 0 0 0 0 0 0 0 0 0 0 0 0 0 0 0 0 effect 0 0 0 0 0 0 0 0 0 0 0 0 0
245,245,342,273,Other market-maker gripes: Program trading also causes the Nasdaq Composite Index to lose ground against other segments of the stock market.,0 0 0 0 0 0 0 cause 0 0 0 0 0 0 0 effect 0 0 0 0 0 0 0 0 0,cause,0 0 0 0 0 0 0 trigger1 0 0 0 0 0 0 0 effect 0 0 0 0 0 0 0 0 0
246,246,530,26,"These clients also invest 51% of their IT budget on growth and innovation versus maintenance, which is double the industry average, proving the banks' IT investment is adding tangible value to their business.",0 condition 0 0 0 0 0 0 0 0 0 0 0 0 0 0 0 0 0 0 0 0 0 0 0 0 0 0 0 0 0 0 0 effect 0 0 0 0,enable,0 trigger1 0 0 0 0 0 0 0 0 0 0 0 0 0 0 0 0 0 0 0 0 0 0 0 0 0 0 0 0 0 0 0 effect 0 0 0 0
247,247,278,209,The thrift and the holders had suspended their lawsuits as part of the agreement.,0 0 0 0 0 0 effect 0 0 0 0 0 0 cause 0,cause,0 0 0 0 0 0 effect 0 0 0 0 0 0 trigger1 0
248,248,463,34,"The European Commission on Wednesday said it regretted the ""unilateral decision"" by Switzerland to terminate talks on a long-negotiated cooperation agreement.",0 0 0 0 0 0 0 0 0 0 0 prevention 0 0 0 0 0 0 0 0 0 0 0 0 effect 0,prevent,0 0 0 0 0 0 0 0 0 0 0 trigger1 0 0 0 0 0 0 0 0 0 0 0 0 effect 0
249,249,385,316,Lawmakers have been accused of carving district lines around the constituents that will give their party an advantage and secure political gains.,0 0 0 0 0 cause 0 0 0 0 0 0 0 effect 0 0 0 0 0 0 0 0 0,cause,0 0 0 0 0 trigger1 0 0 0 0 0 0 0 effect 0 0 0 0 0 0 0 0 0
250,250,435,6,"Ukraine, which applied to join the US-led alliance in 2008, is pressing Western powers for more support as it seeks to deter any new aggression from Moscow.",0 0 0 0 0 0 0 0 0 0 0 0 0 0 0 0 0 0 0 0 prevention 0 0 0 0 0 0 0 effect 0 0 0,prevent,0 0 0 0 0 0 0 0 0 0 0 0 0 0 0 0 0 0 0 0 trigger1 0 0 0 0 0 0 0 effect 0 0 0
251,251,537,33,"""The longer-term results from the ANDROMEDA study show sustained overall deep haematologic responses and further establish the potential of the subcutaneous formulation of daratumumab as a new treatment regimen in patients with AL amyloidosis, and I'm also encouraged to see additional investigational data showing cardiac and renal responses in these patients.""",0 0 0 0 0 condition 0 0 0 0 0 0 0 0 0 0 0 0 0 0 0 0 0 0 0 0 0 0 0 0 effect 0 0 0 0 0 0 0 0 0 0 0 0 0 0 0 0 0 0 0 0 0 0 0 0 0 0 0,enable,0 0 0 0 0 trigger1 0 0 0 0 0 0 0 0 0 0 0 0 0 0 0 0 0 0 0 0 0 0 0 0 effect 0 0 0 0 0 0 0 0 0 0 0 0 0 0 0 0 0 0 0 0 0 0 0 0 0 0 0
252,252,13,13,"Sotheby's Holdings Inc., the parent of the auction house Sotheby's, said its net loss for the seasonally slow third quarter narrowed from a year earlier on a leap in operating revenue.    ",0 0 0 0 0 0 0 0 0 0 0 0 0 0 0 0 0 0 0 0 0 0 0 0 0 0 0 0 0 0 0 0 0 0 0 0 0,0,0 0 0 0 0 0 0 0 0 0 0 0 0 0 0 0 0 0 0 0 0 0 0 0 0 0 0 0 0 0 0 0 0 0 0 0 0
253,253,7,7,"""As we regain our leadership level where we have been, and as we continue to put new products into the marketplace and need additional capacity, we will look at resuming our involvement with our plan,"" he said.    ",0 0 0 0 0 0 0 0 0 0 0 0 0 0 0 0 0 0 0 0 0 0 0 0 0 0 0 0 0 0 0 0 0 0 0 0 0 0 0 0 0 0 0 0,0,0 0 0 0 0 0 0 0 0 0 0 0 0 0 0 0 0 0 0 0 0 0 0 0 0 0 0 0 0 0 0 0 0 0 0 0 0 0 0 0 0 0 0 0
254,254,585,81,"""I want to make it clear on the floor of the house... that Pakistan, under the leadership of Imran Khan, will never allow any American base on its soil.""",0 0 0 0 0 0 0 0 0 0 0 0 0 0 0 condition 0 0 0 0 0 0 0 0 0 0 0 0 effect 0 0 0 0 0 0,enable,0 0 0 0 0 0 0 0 0 0 0 0 0 0 0 trigger1 0 0 0 0 0 0 0 0 0 0 0 0 effect 0 0 0 0 0 0
255,255,358,289,"The White House yesterday disclosed that Kuwait's ousted government has formally asked the U.S. to enforce the total trade embargo the United Nations has imposed on Iraq, allowing the U.S. and other nations to immediately begin stopping ships carrying Iraqi goods.   ",0 0 0 0 0 0 0 0 0 0 0 0 0 0 0 0 condition 0 0 0 0 0 0 0 0 0 0 0 0 0 0 0 0 0 0 0 0 effect 0 0 0 0 0 0 0,enable,0 0 0 0 0 0 0 0 0 0 0 0 0 0 0 0 trigger1 0 0 0 0 0 0 0 0 0 0 0 0 0 0 0 0 0 0 0 0 effect 0 0 0 0 0 0 0
256,256,15,15,"The move rewards shareholders and should improve the stock's liquidity, Oneida said. ",0 0 0 0 0 0 0 0 0 0 0 0 0 0 0,0,0 0 0 0 0 0 0 0 0 0 0 0 0 0 0
257,257,204,135,"Since KKR bought RJR in February for $25 billion of debt, it has agreed to sell nearly $5 billion of RJR assets. ",0 0 cause 0 0 0 0 0 0 0 0 0 0 0 0 0 0 effect 0 0 0 0 0 0 0 0,cause,0 0 trigger1 0 0 0 0 0 0 0 0 0 0 0 0 0 0 effect 0 0 0 0 0 0 0 0
258,258,11,11,"Until recently, Kellogg had been telling its sales force and Wall Street that by 1992 it intended to achieve a 50% share of market, measured in dollar volume.    ",0 0 0 0 0 0 0 0 0 0 0 0 0 0 0 0 0 0 0 0 0 0 0 0 0 0 0 0 0 0 0 0 0,0,0 0 0 0 0 0 0 0 0 0 0 0 0 0 0 0 0 0 0 0 0 0 0 0 0 0 0 0 0 0 0 0 0
259,259,114,45,The SEC has alleged that Mr. Antar aimed to pump up the company's stock price through false financial statements in order to sell his stake and reap huge profits.,0 0 0 0 0 0 0 0 0 intention 0 0 0 0 0 0 0 0 0 0 0 0 0 effect 0 0 0 0 0 0 0,intend,0 0 0 0 0 0 0 0 0 trigger1 0 0 0 0 0 0 0 0 0 0 0 0 0 effect 0 0 0 0 0 0 0
260,260,292,223,"On Friday, Intel began notifying customers about the bugs which cause the chip to give wrong answers for some mathematical calculations.    ",0 0 0 0 0 0 0 0 0 cause 0 0 0 0 0 0 0 effect 0 0 0 0 0 0,cause,0 0 0 0 0 0 0 0 0 trigger1 0 0 0 0 0 0 0 effect 0 0 0 0 0 0
261,261,194,125,"Through the first nine months, the company had a loss of $484 million, largely reflecting the closing of its supercomputer unit.    ",0 0 0 0 0 0 0 0 0 0 cause 0 0 0 0 0 0 0 0 effect 0 0 0 0 0 0,cause,0 0 0 0 0 0 0 0 0 0 trigger1 0 0 0 0 0 0 0 0 effect 0 0 0 0 0 0
262,262,503,75,"The trio, all involved in management of the cable car, are accused of deliberately deactivating the emergency brake that could have stopped it slamming into the side of the Mottarone mountain when the cable snapped on Sunday afternoon.",0 0 0 0 0 0 0 0 0 0 0 0 0 0 0 0 prevention 0 0 0 0 0 0 0 0 effect 0 0 0 0 0 0 0 0 0 0 0 0 0 0 0,prevent,0 0 0 0 0 0 0 0 0 0 0 0 0 0 0 0 trigger1 0 0 0 0 0 0 0 0 effect 0 0 0 0 0 0 0 0 0 0 0 0 0 0 0
263,263,524,20,"Through this acquisition, Amazon would empower MGM to continue to do what they do best: great storytelling.""",0 0 condition 0 0 0 0 0 0 0 0 0 0 0 0 0 0 0 effect 0 0,enable,0 0 trigger1 0 0 0 0 0 0 0 0 0 0 0 0 0 0 0 effect 0 0
264,264,304,235,"The directors said if Messrs. Drabinsky and Gottlieb mail an offer to shareholders by Nov. 22, it will reimburse them a maximum of C$8.5 million for expenses related to a bid.    ",0 0 0 0 0 0 0 0 0 0 cause 0 0 0 0 0 0 0 0 effect 0 0 0 0 0 0 0 0 0 0 0 0 0 0 0,cause,0 0 0 0 0 0 0 0 0 0 trigger1 0 0 0 0 0 0 0 0 effect 0 0 0 0 0 0 0 0 0 0 0 0 0 0 0
265,265,217,148,"In addition, Hewlett-Packard acquired a two-year option to buy an extra 10%, of which half may be sold directly to Hewlett-Packard by Octel. ",0 0 0 0 0 0 cause 0 0 0 0 0 0 effect 0 0 0 0 0 0 0 0 0 0 0 0 0 0 0 0 0 0 0,cause,0 0 0 0 0 0 trigger1 0 0 0 0 0 0 effect 0 0 0 0 0 0 0 0 0 0 0 0 0 0 0 0 0 0 0
266,266,521,17,"Police are authorised to carry out random spot checks to ensure that quarantine rules are respected, with non-compliance punished with fines of up to 1,500 euros ($1,800).",0 0 0 0 0 0 0 0 condition 0 0 0 effect 0 0 0 0 0 0 0 0 0 0 0 0 0 0 0 0 0 0 0 0 0,enable,0 0 0 0 0 0 0 0 trigger1 0 0 0 effect 0 0 0 0 0 0 0 0 0 0 0 0 0 0 0 0 0 0 0 0 0
267,267,357,288,But even continued military success carries political anddiplomatic risks for President Bush and the U.S. The alliedrejection of the last-minute Soviet-led diplomatic effort to avoid the ground war enabled Mr. Bush to seize the initiativefrom an Iraq seemingly bent on dictating peace terms.,0 0 0 0 0 0 0 0 0 0 0 0 0 0 0 0 0 0 0 0 0 0 0 0 0 0 0 0 0 0 0 0 0 0 0 0 effect 0 0 0 0 0 0 0 0 0 0 0,enable,0 0 0 0 0 0 0 0 0 0 0 0 0 0 0 0 0 0 0 0 0 0 0 0 0 0 0 0 0 0 0 0 0 0 0 0 effect 0 0 0 0 0 0 0 0 0 0 0
268,268,102,33,"Lawrence Insurance also sold 3.2 million of its shares for $7.125 each to its parent, Lawrence Group Inc. Lawrence Insurance, based in Albany, N.Y., plans to use the $22.5 million in proceeds to help finance the acquisition of United Republic.    ",0 0 0 0 0 0 0 0 0 0 0 0 0 0 0 0 0 0 0 0 0 0 0 0 0 0 0 0 0 0 0 intention 0 0 0 0 0 0 0 effect 0 0 0 0 0 0 0 0,intend,0 0 0 0 0 0 0 0 0 0 0 0 0 0 0 0 0 0 0 0 0 0 0 0 0 0 0 0 0 0 0 trigger1 0 0 0 0 0 0 0 effect 0 0 0 0 0 0 0 0
269,269,494,66,"Google and HCA said that security will be in place to protect health data, which has strict protections under US law.",0 0 0 0 0 prevention 0 0 0 0 0 0 0 effect 0 0 0 0 0 0 0 0 0,prevent,0 0 0 0 0 trigger1 0 0 0 0 0 0 0 effect 0 0 0 0 0 0 0 0 0
270,270,456,27,"   
The Exhibition will be held both online and on-site, as a hybrid format, which will showcase the cutting-edge technologies and products of exhibitors in various ways.",0 0 0 0 0 0 0 0 0 0 0 0 0 0 0 prevention prevention 0 0 0 effect 0 0 0 0 0 0 0 0 0 0 0 0 0,prevent,0 0 0 0 0 0 0 0 0 0 0 0 0 0 0 trigger1 trigger1 0 0 0 effect 0 0 0 0 0 0 0 0 0 0 0 0 0
271,271,489,61,"""If they can ban president Trump, all conservative voices could be next,"" House Minority Leader Kevin McCarthy tweeted.",0 0 prevention 0 0 0 0 0 0 0 effect 0 0 0 0 0 0 0 0 0 0 0 0,prevent,0 0 trigger1 0 0 0 0 0 0 0 effect 0 0 0 0 0 0 0 0 0 0 0 0
272,272,510,6,"Among individual companies, Amazon edged up 0.1 percent after announcing it would acquire the storied MGM studios for $8.45 billion, giving the US tech giant a vast library to further its ambitions in streaming.",0 0 0 0 0 0 0 0 0 0 0 0 0 condition 0 0 0 0 0 0 0 0 0 0 0 0 0 0 0 0 0 0 0 0 effect 0 0 0,enable,0 0 0 0 0 0 0 0 0 0 0 0 0 trigger1 0 0 0 0 0 0 0 0 0 0 0 0 0 0 0 0 0 0 0 0 effect 0 0 0
273,273,16,16,London shares were depressed initially by overnight losses in New York and by the drop in sterling after Mr. Lawson's resignation.,0 0 0 0 0 0 0 0 0 0 0 0 0 0 0 0 0 0 0 0 0 0 0,0,0 0 0 0 0 0 0 0 0 0 0 0 0 0 0 0 0 0 0 0 0 0 0
274,274,416,347,"The number of those hospitalized climbed from the 34 reported Saturday, because information has trickled in from area hospitals, Khan said.",0 0 0 0 0 effect 0 0 0 0 0 0 0 0 0 cause 0 0 0 0 0 0 0 0,cause,0 0 0 0 0 effect 0 0 0 0 0 0 0 0 0 trigger1 0 0 0 0 0 0 0 0
275,275,250,181,Iraq said the roundup was  to protect them from unspecifiedthreats; British Foreign Office minister William Waldegrave calledthe order ``grave and sinister.'',0 0 0 cause 0 0 effect 0 0 0 0 0 0 0 0 0 0 0 0 0 0 0 0 0 0 0,cause,0 0 0 trigger1 0 0 effect 0 0 0 0 0 0 0 0 0 0 0 0 0 0 0 0 0 0 0
276,276,129,60,It also was considering a restructuring to help boost the stock price.,0 0 0 0 0 intention 0 effect 0 0 0 0 0,intend,0 0 0 0 0 trigger1 0 effect 0 0 0 0 0
277,277,159,90,"The sale of shares to the McAlpine family along with the recent sale of 750,000 shares of Meridian stock to Haden MacLellan Holding PLC of Surrey, England and a recent public offering have increased Meridian's net worth to $8.5 million, said William Feniger, chief executive officer of Toledo, Ohio-based Meridian. ",0 cause 0 0 0 0 0 0 0 0 0 0 cause 0 0 0 0 0 0 0 0 0 0 0 0 0 0 0 0 0 0 0 0 0 effect 0 0 0 0 0 0 0 0 0 0 0 0 0 0 0 0 0 0 0 0 0 0 0 0,cause,0 trigger1 0 0 0 0 0 0 0 0 0 0 trigger1 0 0 0 0 0 0 0 0 0 0 0 0 0 0 0 0 0 0 0 0 0 effect 0 0 0 0 0 0 0 0 0 0 0 0 0 0 0 0 0 0 0 0 0 0 0 0
278,278,535,31,"Varo Bank, using Temenos SaaS, estimates that it services customers at 25% of the total costs incurred by a traditional bank.",0 effect 0 0 0 condition 0 0 0 0 0 0 0 0 0 0 0 0 0 0 0 0 0 0 0,enable,0 effect 0 0 0 trigger1 0 0 0 0 0 0 0 0 0 0 0 0 0 0 0 0 0 0 0
279,279,436,7,Total said it would continue to produce gas so as not to disrupt electricity supply in either country.,0 0 0 0 0 0 prevention 0 0 0 0 0 effect 0 0 0 0 0 0,prevent,0 0 0 0 0 0 trigger1 0 0 0 0 0 effect 0 0 0 0 0 0
280,280,185,116,"Dataproducts Inc. said it filed a lawsuit in Delaware Chancery Court to block a tender offer by DPC Acquisition Partners, alleging that the hostile offer violates a standstill agreement between the two concerns.    ",0 0 0 0 0 0 cause 0 0 0 0 0 effect 0 0 0 0 0 0 0 0 0 0 0 0 0 0 0 0 0 0 0 0 0 0 0,cause,0 0 0 0 0 0 trigger1 0 0 0 0 0 effect 0 0 0 0 0 0 0 0 0 0 0 0 0 0 0 0 0 0 0 0 0 0 0
281,281,73,4,The university had sought an injunction blocking Connaught's board from recommending or supporting an offer for the company by Merieux.,0 0 0 prevention 0 0 effect 0 0 0 0 0 0 0 0 0 0 0 0 0 0 0,prevent,0 0 0 trigger1 0 0 effect 0 0 0 0 0 0 0 0 0 0 0 0 0 0 0
282,282,427,358,"If you really believe a business issue is interesting, writing a letter to an editor of a newspaper and getting it published is a way of raising your profile.",0 0 0 0 0 0 0 0 0 0 0 0 0 0 0 0 0 0 0 0 0 0 cause 0 0 0 0 effect 0 0 0,cause,0 0 0 0 0 0 0 0 0 0 0 0 0 0 0 0 0 0 0 0 0 0 trigger1 0 0 0 0 effect 0 0 0
283,283,367,298,"While a prisoner, Maria witnessed a sickening trade in human life and recalls how young girls were drugged, forced into prostitution and then murdered.",0 0 0 0 0 cause 0 0 0 0 0 0 0 0 0 0 0 0 0 0 effect 0 0 0 0 0 0,cause,0 0 0 0 0 trigger1 0 0 0 0 0 0 0 0 0 0 0 0 0 0 effect 0 0 0 0 0 0
284,284,477,48,But NATO members remain reluctant to embrace Ukraine as they want to avoid ratcheting up tensions with Russia.,0 0 0 0 0 0 prevention 0 0 0 0 0 0 effect 0 0 0 0 0,prevent,0 0 0 0 0 0 trigger1 0 0 0 0 0 0 effect 0 0 0 0 0
285,285,303,234,"Profit from coal fell to $41 million from $58 million, partly because of a miners' strike. ",0 0 0 effect 0 0 0 0 0 0 0 0 0 0 0 0 0 0 0 cause 0,cause,0 0 0 effect 0 0 0 0 0 0 0 0 0 0 0 0 0 0 0 trigger1 0
286,286,366,297,"Even before her 18th birthday, Maria had already been enslaved by a gang of human traffickers and held in captivity for four months in her homeland of Mexico.",0 0 0 0 0 0 0 0 0 0 cause 0 0 0 0 0 0 0 effect 0 0 0 0 0 0 0 0 0 0 0,cause,0 0 0 0 0 0 0 0 0 0 trigger1 0 0 0 0 0 0 0 effect 0 0 0 0 0 0 0 0 0 0 0
287,287,442,13,"Therefore, ""Uruguay is not going to request an extradition in order not to obstruct the extradition process to Italy, which is where he has committed the most serious crimes,"" he said.",0 0 0 0 0 prevention prevention prevention prevention 0 effect 0 0 0 0 0 0 0 0 0 0 0 0 0 0 0 0 0 0 0 0 0 0 0 0 0 0,prevent,0 0 0 0 0 trigger1 trigger1 trigger1 trigger1 0 effect 0 0 0 0 0 0 0 0 0 0 0 0 0 0 0 0 0 0 0 0 0 0 0 0 0 0
288,288,83,14,"Secretary of State James Baker, speaking on ABC News' ""This Week,"" said the Kuwaiti request gives the U.S. and other countries ""a legal basis for stopping the export of oil and that sort of thing."" ",0 0 0 0 0 0 0 0 0 0 0 0 0 0 0 0 0 0 0 effect 0 0 0 0 0 0 0 0 0 0 0 0 0 prevention 0 0 0 0 0 0 0 0 0,prevent,0 0 0 0 0 0 0 0 0 0 0 0 0 0 0 0 0 0 0 effect 0 0 0 0 0 0 0 0 0 0 0 0 0 trigger1 0 0 0 0 0 0 0 0 0
289,289,528,24,China's central bank also granted a $1.5 billion currency swap to finance imports from China in February as the rupee hit a record low of 202.73 to the dollar.,0 0 0 condition 0 0 0 0 0 0 0 0 0 effect 0 0 0 0 0 0 0 0 0 0 0 0 0 0 0 0 0 0,enable,0 0 0 trigger1 0 0 0 0 0 0 0 0 0 effect 0 0 0 0 0 0 0 0 0 0 0 0 0 0 0 0 0 0
290,290,276,207,"Robert Mellor, Di Giorgio's executive vice president, said the company stands to reap more money through the sale of individual units to others than by accepting DIG's offer. ",0 0 0 0 0 0 0 0 0 0 0 0 0 0 0 effect 0 0 0 0 cause 0 0 0 0 0 0 0 0 0 0 0 0,cause,0 0 0 0 0 0 0 0 0 0 0 0 0 0 0 effect 0 0 0 0 trigger1 0 0 0 0 0 0 0 0 0 0 0 0
291,291,271,202,The quarterly results also reflected $21.4 million in non-recurring losses from commercial real-estate activities in California.,0 0 0 0 0 0 0 0 0 0 0 0 effect 0 0 0 0 0 cause 0 0 0,cause,0 0 0 0 0 0 0 0 0 0 0 0 effect 0 0 0 0 0 trigger1 0 0 0
292,292,360,291,"On Friday, Iran's foreign minister said he believes a solution will be reached over a proposed deal to export uranium for enrichment abroad, a demand of Western nations that worry that Tehran plans to use its program to build nuclear weapons.""",0 0 0 0 0 0 0 0 0 0 0 0 0 0 0 0 0 0 0 0 0 0 0 0 0 0 0 0 0 0 0 0 0 0 0 0 0 intention 0 0 0 effect 0 0 0 0,intend,0 0 0 0 0 0 0 0 0 0 0 0 0 0 0 0 0 0 0 0 0 0 0 0 0 0 0 0 0 0 0 0 0 0 0 0 0 trigger1 0 0 0 effect 0 0 0 0
293,293,239,170,The charges were offset in part by a gain from the sale of the company's construction division.,0 0 0 0 0 0 0 0 effect 0 0 cause 0 0 0 0 0 0 0,cause,0 0 0 0 0 0 0 0 effect 0 0 trigger1 0 0 0 0 0 0 0
294,294,101,32,"Acquisition has launched a suit in a Delaware court seeking the withdrawal of Dunkin's poison pill rights and employee stock ownership plans, which it claims were put in place to deter bidders. ",0 0 intention 0 0 0 0 0 0 0 0 effect 0 0 0 0 0 0 0 0 0 0 0 0 0 0 0 0 0 0 0 0 0 0 0,intend,0 0 trigger1 0 0 0 0 0 0 0 0 effect 0 0 0 0 0 0 0 0 0 0 0 0 0 0 0 0 0 0 0 0 0 0 0
295,295,6,6,The agreement is subject to regulatory approval and resolution of lawsuits brought by certain Diversified holders in connection with the proposed merger.,0 0 0 0 0 0 0 0 0 0 0 0 0 0 0 0 0 0 0 0 0 0 0,0,0 0 0 0 0 0 0 0 0 0 0 0 0 0 0 0 0 0 0 0 0 0 0
